Author,Upvotes,Comments,Created_At,Title,NSFW,Post_Flair
2XFN1UTu5F,1,4,2023-10-04 11:24:17,smtpmail-smtp-service resets to 25,False,Question
ummt,6,6,2023-10-04 10:12:41,Trouble launching Flatpak Firefox from Emacs,False,
CountMoosuch,19,13,2023-10-04 08:51:52,How much support for old versions of Emacs should I provide?,False,Question
AutoModerator,3,14,2023-10-04 08:15:08,"Weekly Tips, Tricks, &c. Thread",False,
olivuser,10,8,2023-10-04 07:41:16,Implementation of the TimeTimer in Emacs,False,
unduly-noted,7,5,2023-10-04 02:32:25,org-mode: how to keep whitespace around headings consistent?,False,
ahyatt,18,0,2023-10-04 01:03:07,"Release 0.4 of ekg: drafts, ""magic tags"", llms and file notes!",False,Announcement
hasselprassel,7,11,2023-10-03 21:48:52,Notion like tree viewer for notes,False,
vjgoh,4,5,2023-10-03 17:50:58,treesit grammar issue in Windows/Unreal c++ classes,False,
RobThorpe,6,13,2023-10-03 16:48:03,Using 'M-x compile' for a Python Venv,False,Question
danielkraj,2,33,2023-10-03 12:01:01,(elfeed-deref (elfeed-entry-tags entry)) doesn't work,False,
druuuun,7,6,2023-10-03 10:14:10,How to use the latest version of Eglot with Elpaca?,False,
Horrih,4,6,2023-10-03 09:48:22,Access to clipboard history on windows,False,
github-alphapapa,11,2,2023-10-03 06:16:34,Release v0.13 · alphapapa/ement.el (Matrix client for Emacs),False,Announcement
MaxCenTrump,15,50,2023-10-03 06:10:58,PDF in Emacs,False,
unixbhaskar,6,7,2023-10-03 03:57:10,How I feel after coding in Emacs #emacs #coding #pavarotti,False,emacs-fu
Unknown,11,4,2023-10-03 01:05:51,How do I make this button bigger? It is very small on 4k screen.,False,Question
vjgoh,7,10,2023-10-02 22:26:31,Where do I find the definition of the indentation modes? Any way to use .clang-format instead?,False,Question
Far-Anywhere2876,4,4,2023-10-02 22:09:49,Is there a way to define an org entity in a way that it does not require a backslash?,False,
rnadler,16,1,2023-10-02 20:52:02,Introducing elfeed-curate,False,
LionyxML,18,3,2023-10-02 20:19:20,auto-dark-emacs - Updates on Linux: Gnome / Android (Termux),False,
Hercislife23,4,0,2023-10-02 16:27:46,LSP Mode breadcrumbs icon blurry,False,
nonreligious,3,1,2023-10-02 16:21:11,sage-shell-mode hangs when trying to run help(foo),False,Solved
roboticfoxdeer,137,38,2023-10-02 15:34:45,EXWM is rewiring my brain and I love it,False,
paarulakan,0,10,2023-10-02 14:01:37,Capturing notes to particular file org-capture,False,
VentGrey,3,15,2023-10-02 01:33:19,Indentation issues with emacs configuration,False,Solved
unixbhaskar,21,4,2023-10-02 00:30:19,"Speed up Emacs with features, requires, and autoloads",False,emacs-fu
Bortolo_II,4,2,2023-10-01 20:51:17,Auctex,False,
tesheabebe,6,13,2023-10-01 14:36:07,how to configure LSP (Language Server Protocol) for TypeScript with ESLint and Tailwind CSS in Emacs at the same time?,False,
ann4n,37,152,2023-10-01 12:44:32,What are your thoughts on their criticism of Emacs?,False,
Midnight_oD,56,31,2023-10-01 04:39:06,"new to emacs, hi",False,
RevolutionaryWave795,3,2,2023-10-01 03:28:14,Recommendation for a programming language mode to edit juniper config files?,False,Question
Gus_Gustavsohn,5,18,2023-10-01 00:06:17,What do you use to code on emacs lisp?,False,Question
yasser_kaddoura,0,4,2023-09-30 21:13:09,How to setup indentation for a mode,False,Question
Far-Anywhere2876,2,1,2023-09-30 20:43:18,Nand2tetris in org mode?,False,
jvillasante,4,1,2023-09-30 19:38:47,emacs29 treesit support,False,
haxguru,11,15,2023-09-30 18:47:57,How do I improve my development experience in Emacs?,False,Question
gopherinhole,29,66,2023-09-30 17:42:37,Is it too late to learn emacs as a vim lifer?,False,Question
gdanov,1,6,2023-09-30 15:57:59,hightlight current syntax tree branch?,False,
magthe0,18,32,2023-09-30 15:10:27,Using Emacs as $EDITOR,False,
Far-Anywhere2876,8,20,2023-09-30 14:51:14,How do I get a left pointer for file searching and interactive commands?,False,
danielkraj,5,16,2023-09-29 20:59:38,Is anyone using elfeed? I'm trying to add a hook to send desktop notification when articles become available.,False,
chmouelb,2,1,2023-09-29 19:54:45,flymake mode to codespell,False,Announcement
floorgh0st,5,4,2023-09-29 19:48:13,Emacs Module Critique,False,
tonyaldon,0,1,2023-09-29 19:28:43,Do you know how to list org-mode source blocks with Emacs Lisp?,False,
danielkraj,1,19,2023-09-29 18:53:41,How do you load a package without ;;;autoloads header? (doom emacs),False,
tesheabebe,28,18,2023-09-29 18:13:44,how to make lsp and eglot way faster like neovim?,False,Solved
sunmoi,6,12,2023-09-29 16:30:10,Advice on improving the performance of pdf-tools,False,
zebisnaga,4,10,2023-09-29 15:10:05,Archiving in the same file in orgmode,False,
lushcries,2,11,2023-09-29 14:57:01,emacs org mode on windows,False,Question
thetemp_,4,2,2023-09-29 14:54:04,debian: How-to on backporting an Emacs 29.1 package with pgtk and xwidgets-webkit support,False,
zoliky,5,22,2023-09-29 11:58:03,Is it possible to compile Emacs without requiring sudo access into the home folder? Are there any disadvantages associated with doing so?,False,
buhtz,7,15,2023-09-29 09:12:51,doom-modline / all-the-icons: Of course not working in terminal,False,
JohnDoe365,1,0,2023-09-29 08:37:14,Extract (Copy) multiple files in tar mode,False,
juicecelery,2,4,2023-09-29 07:49:18,"How to port such statements: ""json-alist.choices[0].message.content"" to succinct Emacs Lisp?",False,
ReybirdLee,9,5,2023-09-29 04:26:26,What to do without vim-test or neotest?,False,
Far-Anywhere2876,7,1,2023-09-29 03:46:49,How can I use lsp-grammarly in org mode with minimal UI?,False,
tdavey,2,2,2023-09-28 22:28:20,tab-line-close-tab() yields (args-out-of-range 0 0) -- ideas?,False,
ImportanceFit1412,19,59,2023-09-28 20:00:43,Best Emacs tools and set ups for RSI…??,False,
redditisinmyheart,1,3,2023-09-28 19:55:32,Saved macro stopped working after I updated Emacs (Windows 10),False,Question
mumbo1134,10,22,2023-09-28 19:14:05,Question about treesitter highlighting customization,False,
Keybug,3,1,2023-09-28 15:37:40,Question on strikethrough formatting applied via noexport tag,False,
oldjawbone,45,19,2023-09-28 15:17:55,org-side-tree: Navigate Org mode outlines in Emacs via side window,False,Announcement
paarulakan,2,3,2023-09-28 12:56:08,Emacs for web scraping,False,Question
Extra_Orchid_9830,0,7,2023-09-28 12:40:07,Shortcuts only activated after fist use ?,False,
Shivalicious,7,2,2023-09-28 07:02:03,Building Emacs from Source on Windows [before a reinstallation made it stop working],False,
paarulakan,1,2,2023-09-28 06:52:19,Functions for opening list of custom list of file with keychords,False,Question
Far-Anywhere2876,4,8,2023-09-28 02:59:43,Is there a way to design an org block that acts as a mini-terminal?,False,
dotancohen,3,4,2023-09-28 00:13:28,"Follow links with RET, in org mode and in documentation, with Evil",False,Question
xeyenn,4,2,2023-09-27 20:25:16,defun to read PDF and scroll up or down a line in a customizable way.,False,
ankitrgadiya,12,0,2023-09-27 17:12:20,Implement Custom Tramp Method in Emacs,False,emacs-fu
cottasteel,44,4,2023-09-27 15:51:53,company-org-table: Excel-like auto-completion for Org table cells,False,
arthurno1,4,2,2023-09-27 15:19:42,Use Bash aliases in interactive shell-comands,False,emacs-fu
Neolomoxem,4,3,2023-09-27 09:38:17,How do i change the active DAP template?,False,Question
AutoModerator,7,20,2023-09-27 08:15:08,"Weekly Tips, Tricks, &c. Thread",False,
whudwl,2,4,2023-09-27 05:13:20,Prevent orgmode from adding an ID property to the very top of org file,False,Question
DurableOne,10,0,2023-09-27 02:19:00,Orgmunge is now on PyPi,False,
SS4L1234,3,8,2023-09-27 00:01:37,How to make a keybinding *sometimes* alias another (code auto-complete)?,False,
amake,33,5,2023-09-26 22:44:14,Orgro app update: editing!,False,
BattleGawks,8,10,2023-09-26 21:15:35,How to install treesitter for Org-Mode?,False,
jchx,1,1,2023-09-26 20:49:37,org-mode CLOCK_MODELINE_TOTAL as a file property,False,
Magazine_Ill,0,6,2023-09-26 18:37:28,how to add support for nunjack template files!,False,Question
Magazine_Ill,7,8,2023-09-26 17:52:54,how to make a keybind for something i found in M-x?,False,Question
lllllll22,0,3,2023-09-26 17:05:36,Problem with new installation,False,
ttv_toeasy13,3,3,2023-09-26 16:14:38,Term separate from emacs/programs inside emacs buffer,False,Question
AkiNoHotoke,4,2,2023-09-26 14:42:58,Emacs keybindings in the jupyter notebook text areas,False,Question
Present_Assist3730,0,3,2023-09-26 09:46:51,Deutsche Umlaute werden nicht angezeigt,False,
Magazine_Ill,8,5,2023-09-26 08:41:03,Can i use vim-adventures game to learn evil-mode?,False,Question
Extra_Orchid_9830,3,6,2023-09-26 08:39:56,dump-jump,False,Solved
stefrex,1,2,2023-09-26 08:01:46,Encounter stuck in a few seconds when switch between frames,False,
SS4L1234,1,1,2023-09-26 00:39:21,dired-subtree not working with dired-omit-mode,False,
Altruistic-Carpet-43,18,13,2023-09-26 00:06:43,Easy tip for smoother scrolling I just discovered,False,
unixbhaskar,5,0,2023-09-25 22:47:28,Rightly Transfer Your Emacs System from Windows to Linux,False,emacs-fu
Far-Anywhere2876,5,10,2023-09-25 17:37:00,Is there a way to make src blocks run in sequence if dependent on eachother?,False,
Silerus9768,6,4,2023-09-25 15:32:58,"Is it possible to add an additional lsp when opening a project file? And if So, how?",False,
sudeenhux,17,13,2023-09-25 10:23:22,Mysterious Emacs Keybindings in Apple Mail,False,
nullpspace,0,7,2023-09-25 10:08:23,Help setting up eglot + clangd for C++ development,False,
fmou67,4,4,2023-09-25 07:43:15,Csv-align-mode and first headers line,False,
Silarium,3,4,2023-09-25 03:27:43,Help with displaying #+title: property in Treemacs for Org files,False,
SS4L1234,82,151,2023-09-24 23:08:05,What's something in your emacs config that makes a real difference for you?,False,
Jack-o-tall-tales,4,3,2023-09-24 20:30:13,Why I can't use `forward-line' to move point in another buffer?,False,Question
Ahmed-Dalton,1,5,2023-09-24 14:11:32,flycheck in doom Emacs problem,False,Question
mindgitrwx,2,7,2023-09-24 11:36:11,Is there a way to implement this Vim feature in Emacs using Evil mode?,False,
magthe0,9,1,2023-09-24 09:08:08,Defining a formatter for Cabal files,False,
Scroot,3,2,2023-09-24 02:58:29,"Are conditional, per-project auto-mode mappings possible?",False,
github-alphapapa,42,2,2023-09-23 23:42:49,Release v1.3 · alphapapa/org-super-agenda,False,Announcement
ahyatt,28,0,2023-09-23 21:23:39,New library package 'llm',False,Announcement
redditisinmyheart,0,12,2023-09-23 19:49:03,Still using Emacs 25.3.1 on Windows 10. Any reasons to switch to the latest version?,False,Question
ledmine,37,34,2023-09-23 19:13:10,Learning resources for Emacs,False,
DangerTadpole,37,9,2023-09-23 17:22:17,"New package: MisTTY, a comint alternative with a fully-functional terminal",False,Announcement
SameAsEveryoneElse,10,33,2023-09-23 14:02:47,Help finding a theme,False,
LeonardoZarkli,17,8,2023-09-23 12:41:02,New Tree Sitter Major Mode: typst-ts-mode,False,
imacarpet,7,23,2023-09-23 08:51:20,How can I completely supress the *completions* minibuffer?,False,
SS4L1234,3,4,2023-09-23 06:49:00,Comments that serve as commands?,False,
SS4L1234,2,8,2023-09-23 05:56:06,Setting tool-bar-mode messes with startup,False,
CeamoreCash,4,2,2023-09-23 02:53:42,Workaround to handle key-up events?,False,
danderzei,31,8,2023-09-22 22:36:14,Emacs or Efuns?,False,
Far-Anywhere2876,8,13,2023-09-22 20:51:58,Is it possible to query an org table using sqlite?,False,
Hammar_Morty,9,7,2023-09-22 16:19:06,Is There an Interface for Editing Per-Directory Local Variables?,False,
potatowithascythe,1,11,2023-09-22 13:00:56,"When running the elpaca package manager and installing org mode, it throws an error on org documents",False,Question
AbstProcDo,4,4,2023-09-22 10:08:11,How could edit the results of occur,False,Question
brunjact,10,4,2023-09-22 08:45:34,Calendar: add x days to date,False,
MakeItEnd14,1,0,2023-09-22 07:19:52,Help with emacs evil shotcut to change per mode,False,Question
BukHunt,2,6,2023-09-22 03:49:32,Guide to setup proper code indentation,False,Question
worker55,6,23,2023-09-21 23:29:22,Setting a jump point using xref-find-definitions.,False,Question
cyneox,39,19,2023-09-21 20:10:12,Emacs and the Cybernetic Productivity,False,
Far-Anywhere2876,1,2,2023-09-21 18:02:49,Automatically wrap subfigure links in a centered figure environment.,False,
LostyPints,0,2,2023-09-21 17:33:01,Aggressive Ident - How can i edit how it indents in certain situations,False,Solved
telepath12,1,6,2023-09-21 16:52:26,Weird warnings using Emacs 28.2 (not other versions!),False,Question
AkiNoHotoke,19,45,2023-09-21 11:41:38,Emacs as a window manager but without EXWM,False,Question
markrlondon,65,13,2023-09-21 03:38:34,"This since from the Interview with an Emacs Enthusiast video, but you might have not seen it.",False,
breathe-out,15,0,2023-09-21 02:29:15,chordpro-mode.el version 2.1.0,False,Announcement
Zwzhhh,2,2,2023-09-21 02:11:22,Is it possible to make a child frame that has only tab-bar-mode?,False,
mumbo1134,2,3,2023-09-20 23:43:18,Issue with emacs-29 reading xmodmap,False,
Remote_Tap_7099,72,21,2023-09-20 20:24:35,Version 4.3.0 of the Modus themes has been released!,False,Announcement
