Author,Upvotes,Comments,Created_At,Title,NSFW,Post_Flair
geza42,2,9,2023-10-29 13:27:08,Solution for inserting a filename to a buffer using recursive fuzzy search?,False,
LionyxML,70,16,2023-10-29 13:23:56,Ollama on Emacs with Ellama,False,
cidra_,9,8,2023-10-29 11:03:22,Cancel pending key chain,False,
TiMueller,1,8,2023-10-29 09:25:16,Prevent agenda search from adding all searched files to recentf-list,False,
PrezirePlayz,0,39,2023-10-29 08:17:18,Why emacs,False,Question
karthink,42,7,2023-10-29 07:47:33,gptel 0.5.0: with multi/local LLM support,False,Announcement
github-alphapapa,11,0,2023-10-29 04:15:41,Release v1.2 · alphapapa/org-web-tools,False,Announcement
ElfOfPi,6,15,2023-10-29 02:46:26,Rate my elisp,False,Question
thephatmaster,18,36,2023-10-28 21:12:43,Emacs without a keyboard?,False,
oussama111,0,2,2023-10-28 20:31:11,nov.el doesn't work well with evil-mode,False,
telepath12,10,8,2023-10-28 18:32:24,Integrating Citar and Org-roam,False,Solved
Unknown,8,10,2023-10-28 09:41:10,Using custom packages with Elpaca,False,
g06lin,0,10,2023-10-28 08:38:13,Combining use-package and general,False,
danielkraj,2,7,2023-10-28 01:30:47,Any guide how to change font colors?,False,
spudlyo,25,4,2023-10-27 23:42:24,A literate Org document on building Emacs from source - conditionally for RedHat or Debian,False,
thephatmaster,1,21,2023-10-27 19:35:06,Hardware: BlueTooth Keyboard for Emacs (DooM)?,False,Question
s-kostyaev,21,4,2023-10-27 19:26:46,Ellama moved to llm library and now supports proprietary LLMs as well as open source,False,
ethanzanemiller,7,4,2023-10-27 16:07:29,Possible to use `fd` or some other faster search tool than `find` with consult,False,Question
LostyPints,3,2,2023-10-27 13:16:29,ispell breaks my org-mode heading folding/unfolding,False,
UnitFew5153,1,5,2023-10-27 11:02:19,Search engine,False,
taeknibunadur,2,5,2023-10-27 08:21:20,Changing the value of a theme variable,False,
unixbhaskar,14,2,2023-10-27 05:26:06,My Dired Symlink Hack,False,emacs-fu
Far-Anywhere2876,16,14,2023-10-26 22:04:53,How to create a personal wiki in emacs?,False,
paretoOptimalDev,7,12,2023-10-26 21:09:42,Share your org-mode agenda theme/screenshot (elisp included to auto-generate based on sample org file),False,
jmhimara,17,23,2023-10-26 20:46:51,Can you recommend a version of emacs that works in Windows 98 or older?,False,Question
josior,3,7,2023-10-26 19:29:57,How to preview buffer with HTML in eww/browser?,False,Question
usuario1986,3,3,2023-10-26 18:23:00,Ivy/counsel results order,False,Question
Orest58008,9,19,2023-10-26 18:14:50,Emacs for Rust,False,Question
gonewest818,0,1,2023-10-26 17:42:12,Emacs 29.1 dired-mouse-drag-files crash on macOS,False,
iMagUdspEllr,3,10,2023-10-26 17:30:28,How to follow windows shortcuts in dired,False,
SuLinab,33,72,2023-10-26 11:38:08,Why the journey of learning Emacs and Elisp in 2023 is so hard ?,False,
unixbhaskar,29,0,2023-10-26 11:20:57,Emacs blessings!,False,emacs-fu
skyler544,6,6,2023-10-26 11:03:52,Indentation in yaml-ts-mode,False,
tanrax,7,6,2023-10-26 07:26:53,Script in Elisp to generate a unified RSS feed with several feeds,False,
chmouelb,12,12,2023-10-26 06:57:29,using ruff format with emacs to reformat python files,False,Announcement
littlesisterrun,28,7,2023-10-25 19:45:37,New package: mini-echo.el,False,Announcement
nonreligious,4,21,2023-10-25 14:55:14,`xwidget-webkit` has started crashing Emacs sessions,False,Question
mplscorwin,7,7,2023-10-25 14:54:32,Redumping with pdumper,False,News
vfclists,1,3,2023-10-25 13:37:35,What is the function for reading text line by line from the command line in batch mode?,False,
Coyildiz,13,26,2023-10-25 10:21:28,What is yours configuration for python?,False,
zsome,6,19,2023-10-25 09:57:14,bookmark+ or dogears or ?,False,
divinedominion,39,101,2023-10-25 09:08:01,"Can Emacs do this? – Yes, Emacs can do this",False,emacs-fu
github-alphapapa,7,6,2023-10-25 08:34:49,org-ql-open-link (new command offers links in matching Org entries with completion and opens the selected one directly),False,News
AutoModerator,11,21,2023-10-25 08:15:09,"Weekly Tips, Tricks, &c. Thread",False,
paarulakan,3,2,2023-10-25 08:10:44,Org-publish: Sorting posts based on data in the org file,False,Question
xenodium,27,10,2023-10-24 18:02:23,"Emacs, open file in Xcode at same line",False,
Tibblediggins,6,6,2023-10-24 11:41:25,How to make all temp buffers open in specific window?,False,
rantdubey,1,12,2023-10-24 10:48:29,can't move to the beginning of defun in CC-mode 5.34.1,False,
noobaster-pro-007,4,6,2023-10-24 06:04:42,Failing to load auctex when installed via elpaca,False,
AbstProcDo,28,38,2023-10-24 04:59:34,"Dired drag files, trival but remarkable effective",False,
github-alphapapa,29,9,2023-10-24 00:02:03,Release v0.7.3 · alphapapa/org-ql,False,Announcement
ilemming,14,16,2023-10-23 22:17:38,Magit: cloning for worktrees,False,
fmou67,3,6,2023-10-23 19:51:25,"save-excursion: Wrong type argument: integer-or-marker-p, nil in template definition",False,emacs-fu
JeffreyBenjaminBrown,2,2,2023-10-23 16:44:24,`python-mode` has strong opinions about `outline-minor-mode`. Where are they documented?,False,Question
_Akastos_,1,1,2023-10-23 13:04:20,Doom Emacs & columnview: How to ensure fixed fontsize in columnview?,False,
vfclists,3,5,2023-10-23 11:36:04,Do functions like replace-regexp have the ability to replace groups independently?,False,
jangid,7,14,2023-10-23 03:04:01,"Magit: How do you do ""git pull --no-rebase""?",False,Question
MrPapouille,7,4,2023-10-23 01:41:50,Can Projectile run command when entering a project ?,False,
cazzipropri,27,37,2023-10-23 00:34:12,Smallest device which could run comfortably emacs,False,
Artistic-Safe232,4,12,2023-10-22 22:52:15,Emacs on XQuartz,False,Question
unixbhaskar,6,2,2023-10-22 22:33:31,"ISEARCH tips, settings, options and uses (Advanced Topic)",False,emacs-fu
SlowValue,8,2,2023-10-22 19:40:06,"Emacs 29, native-comp, why jit compiling same files on every start?",False,Solved
Mahir1210,0,2,2023-10-22 18:13:23,Icons not appearing in neotree,False,Solved
geospeck,23,12,2023-10-22 15:59:52,my pain points with Emacs code search and how I fixed them,False,
publicvoit,1,15,2023-10-22 15:22:42,GPT4All mode in Emacs,False,Question
slinchisl,17,3,2023-10-22 14:21:25,Fixing Lsp-Mode's Hover Signatures,False,
Mahir1210,1,2,2023-10-22 10:38:52,Doom sync not working,False,Solved
Decweb,4,11,2023-10-22 04:41:00,Common lisp definition speedbar in slime?,False,Question
zzhjerry,4,6,2023-10-22 02:55:16,Why doesn't vertico-repeat support execute-exetended-command by default?,False,
unixbhaskar,37,10,2023-10-22 01:30:35,Great links to help you learn Emacs Lisp,False,emacs-fu
meedstrom,10,7,2023-10-22 01:08:04,"New package to scratch an itch: let me embed flashcards in simple paragraphs, rather than siloing them in Org subtrees!",False,Announcement
wjcferguson,23,14,2023-10-21 17:52:48,New Journald log viewer package,False,
AbstProcDo,32,17,2023-10-21 13:50:29,Tried gnuplot which plot only require basic math,False,
rya_wcksn,1,2,2023-10-21 13:50:19,[HELP] Theme is different on terminal with daemon and no daemon,False,
zoliky,17,24,2023-10-21 10:51:45,Question for those who use Fastmail with Emacs,False,
Zwzhhh,0,4,2023-10-21 10:40:57,How to increase the font size of context menu for emacs compiled with x-toolkit=no?,False,
paarulakan,3,3,2023-10-21 02:53:14,Workflow for maintaining logs of literate scripts using org-babel,False,
FluffyBrudda,0,74,2023-10-21 01:59:13,how to run doom emacs on flatpak emacs?,False,Question
MinallWch,8,2,2023-10-20 21:34:27,Org mode + Cybersecurity Workflow?,False,Question
usuario1986,3,9,2023-10-20 20:57:15,Delete backup files when saving,False,Question
telenieko,2,11,2023-10-20 13:49:36,Regex Find in files (non-interactive),False,
vfclists,1,6,2023-10-20 13:05:23,How to replace string with a function value?,False,
fmou67,4,1,2023-10-20 08:13:55,Exclude matches in occur based on a list of terms,False,
fmou67,2,1,2023-10-20 07:57:34,"cannot open doc string file ""loaddefs.elc"" shown for many functions in the minibuffer",False,Question
FreeAd7233,108,32,2023-10-20 06:03:40,dape.el: DAP client that does not rely on LSP-mode,False,
sebhoagie,6,10,2023-10-19 21:24:18,Info manuals to install,False,
TechieRefugee,9,2,2023-10-19 17:48:52,EXWM and Polybar - A (Mostly) Satisfying Solution,False,Solved
Freemason_1,2,8,2023-10-19 16:55:34,How to set up lsp-java so that it works for an individual java file?,False,Solved
AbstProcDo,13,14,2023-10-19 15:32:46,Casting spells in PlantUML as a wizard in org babel to translate words to graph,False,
danderzei,53,5,2023-10-19 11:22:40,New version of Emacs Writing Studio: A configuration for authors,False,
unixbhaskar,19,2,2023-10-19 10:51:51,All you need to know about the Emacs OCCUR command in 4 minutes,False,emacs-fu
chesheersmile,7,18,2023-10-19 10:20:29,Is there break undo in Emacs?,False,Solved
jangid,8,4,2023-10-19 10:17:22,Has anyone successfully configured gnus+gmail+oauth2?,False,
arctic-owls,3,5,2023-10-19 10:09:17,Touchpad scrolling issue,False,Question
CorysInTheHouse69,3,5,2023-10-19 07:43:11,How to disable everything from an lsp except for code completion (eglot)?,False,Question
chmouelb,5,0,2023-10-19 05:20:24,consult-vc-modified-files - List git modified files in a project with consult and vc,False,Announcement
BUYXRAYS,0,20,2023-10-19 00:05:34,What is your favorite Emacs flavor/version?,False,
zamansky,35,4,2023-10-18 21:30:17,Back from vacation so continuing with my learning elisp series,False,
jcdix,2,13,2023-10-18 18:55:28,dired+ causes pdf-tools to freeze emacs on large pdfs,False,Question
jsadusk,1,4,2023-10-18 18:50:50,How do I wait for resize events to finish in elisp?,False,
SnooPets20,4,17,2023-10-18 18:29:19,Emacs is inconsistent when clicking buttons with the mouse,False,Question
nayanld,0,0,2023-10-18 17:53:31,Emacs Android: getting error while installing packages,False,Question
Motor_Mouth_,3,2,2023-10-18 17:45:47,Help with functions to drag and drop pdf into bibtex file,False,Question
Spatolone,7,40,2023-10-18 16:01:12,What are the extensions to have functional IDE in zero time?,False,
ziplyx,16,7,2023-10-18 13:34:52,Why was the latest version of spacemacs released in 2018? Is the project no longer maintained?,False,Question
arkoinad,6,14,2023-10-18 08:35:15,Intelligent paste in Emacs,False,
AutoModerator,6,11,2023-10-18 08:15:09,"Weekly Tips, Tricks, &c. Thread",False,
Unknown,12,9,2023-10-18 02:10:57,Getting all keybindings working in the TUI,False,
AbstProcDo,24,12,2023-10-18 01:56:18,Tried plantuml for drawing and it amazing on org babel,False,
unduly-noted,8,8,2023-10-18 01:49:55,opening magit full-frame then restoring windows on q,False,
nqminhuit,4,13,2023-10-18 01:26:58,"How to autofill ""async-shell-command"" with last command",False,
moseswithhisbooks,9,0,2023-10-18 01:13:55,Java: REPL Driven Development with 𝓔𝓶𝓪𝓬𝓼,False,
blureglades,19,23,2023-10-17 19:39:07,Would you recommend EXWM as daily driver?,False,Question
varsderk,8,8,2023-10-17 19:11:18,Using Eat + Eshell,False,
Macksom,1,2,2023-10-17 18:57:30,Troubles with Auto Completion in Doom Emacs,False,Question
ziplyx,0,1,2023-10-17 18:36:29,"Doom emacs users, share your init.el",False,
paarulakan,6,10,2023-10-17 15:37:20,Monitoring emacs extensions that are currently in use,False,
blureglades,2,5,2023-10-17 13:39:05,How to reduce lsp-mode input lag when working on javascript project?,False,Question
cosmologica101,3,2,2023-10-17 13:31:49,`isearch-forward` and `cua` keybindings enabled,False,Solved
egstatsml,28,11,2023-10-17 07:58:42,Window Management - share your display-buffer-alist,False,
cynroach,3,12,2023-10-17 05:49:42,What are the greatest Emacs tips for a beginner? |EMACS IDE/ NOTE-TAKING APPLICATION|.,False,
AbstProcDo,0,11,2023-10-16 23:37:27,"It's symbols not strings are fundamental data type, an insight from read.",False,
graduale,2,0,2023-10-16 16:27:32,Org-mode: Killing subtrees with `visual-line-mode` on,False,Question
ImJustPassinBy,4,9,2023-10-16 16:09:13,Changing projects / environments in eglot,False,Question
Netherus,7,10,2023-10-16 16:07:31,Changing themes in Emacs according to specified time periods,False,
samuelroy_,96,35,2023-10-16 14:23:19,emacs + llm = 🔥,False,
AbstProcDo,7,4,2023-10-16 13:40:35,Exploring a little bit of the Intricacies and Elegance of Loop Macros,False,
siht_psil,12,12,2023-10-16 13:32:00,What are your favourite ugly themes?,False,
s-kostyaev,28,15,2023-10-16 11:53:13,Ellama - new package to call LLMs from Emacs,False,
moseswithhisbooks,24,3,2023-10-16 10:32:48,“Send region to process” for all languages ᕦ( ᴼ ڡ ᴼ )ᕤ,False,
Ardie83,7,13,2023-10-16 09:54:34,"Help, I'm lost! Emacs over SSH? Or something else?",False,
nonreligious,3,4,2023-10-16 05:33:33,straight-freeze-version gives `straight--dir: Wrong type argument:`,False,Solved
AbstProcDo,14,35,2023-10-16 00:51:42,nil or 'nil once worried me,False,
Spiritual_Sprite,11,15,2023-10-16 00:14:24,Emacs for writing,False,Question
unixbhaskar,7,2,2023-10-15 22:33:40,"Get me out of here! Quitting, exiting and recursion in Emacs",False,emacs-fu
Tibblediggins,8,5,2023-10-15 22:06:34,Is there a project.el equivalent of projectile-project-root?,False,
Altruistic-Carpet-43,17,19,2023-10-15 17:15:46,Why is there a use-package declaration inside another use-package config?,False,
Tibblediggins,4,3,2023-10-15 16:49:19,How to force icomplete to execute the inputted command (ignore completions),False,
amiralul,3,1,2023-10-15 15:01:57,Get the content of org files linked in Denote's dynamic blocks?,False,Question
Horrih,31,46,2023-10-15 12:45:42,Why was setopt introduced in emacs 29 ?,False,
chesheersmile,4,7,2023-10-15 11:44:33,Is there something like deft but single file?,False,Question
BobKoss,0,4,2023-10-15 10:05:59,consult error,False,
Jak_from_Venice,3,1,2023-10-15 08:07:49,Centaur tabs error after update,False,Question
Far-Anywhere2876,2,1,2023-10-15 03:11:41,Need help changing jobname for latex export.,False,
PracticalSound,3,5,2023-10-15 00:39:02,Move between template fields in company-mode auto completed function,False,Solved
desgreech,6,3,2023-10-14 22:40:19,Controlling how thick the text is rendered,False,Question
Grumph_101010,4,9,2023-10-14 21:13:26,Need help to make vertico/consult completion in find-file behave like the default emacs behavior.,False,Solved
cmeerw,5,2,2023-10-14 20:46:28,directory-specific indentation with tree-sitter modes,False,Question
Fun-Bunch-4555,2,8,2023-10-14 17:50:44,mbsync with gmail,False,
glee13770334,2,1,2023-10-14 17:18:53,Helper functions for emacs keyboard shortcuts,False,Question
cd21_geek,0,4,2023-10-14 16:56:13,lsp-treemacs icons not showing in Mac Terminal,False,
el_toro_2022,3,3,2023-10-14 12:50:32,Schlau-compile -- a highly configurable compile macro for Emacs supporting any language you need.,False,Announcement
LionyxML,40,6,2023-10-14 04:45:32,Integrating Catppuccin Themes with Auto-Dark,False,
unixbhaskar,19,6,2023-10-14 02:29:30,"4 Great Line Commands in Emacs Including ""flush-lines""",False,
Professional-Goal266,77,45,2023-10-14 01:19:39,"I know it's not for everyone, but I really like my coding workflow...",False,
kp61dude,13,6,2023-10-13 23:21:34,Emacs 29.1 asking (yes or no),False,
Altruistic-Carpet-43,33,18,2023-10-13 22:17:54,Is anything like this available for Emacs? I want a cat to wander around the buffer while I type :),False,
IAmEscalator,0,2,2023-10-13 22:14:08,Evil-tutor is claiming innocence,False,Question
Substantial_Bad1455,2,1,2023-10-13 20:13:05,Strange Behavior with Icons After Installing kde-plasma-desktop,False,Question
ann4n,1,4,2023-10-13 20:02:06,Anyone know how I could replace all newlines in a paragraph with spaces?,False,
SnooPets20,0,17,2023-10-13 17:12:02,Explicit project declaration with project.el,False,Question
yak-er,0,34,2023-10-13 16:27:23,"Beginners, Emacs was not designed for today keyboards. Solutions: a modal package, keyboard with thumb cluster, remap modifiers, caps to ctrl is not enough long term.",False,
Final-Recognition-61,3,3,2023-10-13 15:59:59,A lightweight evil configuration for web developer,False,
a-concerned-mother,36,13,2023-10-13 15:28:32,5 Reasons I Love Emacs Orgmode,False,
bozhidarb,68,12,2023-10-13 15:12:11,Projectile 2.8 is out!,False,
Unknown,10,2,2023-10-13 14:12:23,How to keep a unified init.el between Android and Linux,False,
fuck_all_cars,13,11,2023-10-13 10:48:26,Can you do code review with Magit and Forge?,False,Question
zigling,17,22,2023-10-13 10:37:39,Project.el vs. Projectile: What things can one do that the other cannot?,False,Question
Vultan,4,2,2023-10-13 01:46:14,"Org export to html, images, rescaling, and ImageMagick",False,Question
gunnervi,1,3,2023-10-12 23:40:06,display error in remote emacs (24.3.1) when using theme,False,
Keybug,15,3,2023-10-12 19:26:02,Org mode mouse cut and paste wizardry,False,
mdbulldog,6,9,2023-10-12 17:31:08,Learning resources for emacs,False,
marcbowes,58,142,2023-10-12 17:07:50,Future of remote development,False,
titaniumbones,5,27,2023-10-12 14:55:49,emacs on macos tips?,False,Question
zigling,10,25,2023-10-12 10:26:15,God vs. Devil vs. Evil: What do you use to avoid key chords? Reviews please!,False,Question
pvgelder,2,7,2023-10-12 08:31:10,(Updated) best practices for avoiding loss of work?,False,
No-Jackfruit3921,21,9,2023-10-12 07:22:42,Seaman Emacs - My first published config,False,
ziplyx,4,20,2023-10-12 05:33:15,Where do I start writing my own emacs configuration?,False,Question
Tohiko,7,6,2023-10-11 21:44:05,Link formatting in widgets,False,Question
DarlingEffect,3,2,2023-10-11 21:41:39,"Spurious characters in eldoc buffer (eldoc, clangd)",False,
raincole,6,9,2023-10-11 19:32:49,"eglot gets ""out of sync"" from the buffer and reports false errors",False,Question
sk8ingdom,4,2,2023-10-11 18:33:15,Doom Emacs Terminal git-gutter Character Column Question,False,
Horrih,14,9,2023-10-11 18:13:41,How mature are treesitter major modes for you ?,False,
tallmtt,2,9,2023-10-11 17:52:23,Setting my own variables in init.el,False,
fmou67,3,2,2023-10-11 16:16:18,"Any good way to search for CD, vinyls tracklists and covers... in Musicbrainz, CDDB, Discogs... from emacs",False,Question
_polymatrix,0,9,2023-10-11 15:55:19,Open file popup,False,
sparklingsphere,39,48,2023-10-11 13:07:06,Bad Emacs Defaults,False,emacs-fu
Velnbur,0,4,2023-10-11 12:32:21,How do I disable bold and italic in tree-sitter-hl-mode?,False,Question
olymk2,4,10,2023-10-11 09:47:55,Any suggestions for a Kill Compile Run Execute sequence from emacs in a single step ?,False,
Ornery_Trick8179,4,9,2023-10-11 08:24:58,Store link in org attachments,False,
AutoModerator,5,3,2023-10-11 08:15:10,"Weekly Tips, Tricks, &c. Thread",False,
konrad1977,4,4,2023-10-11 08:01:40,Consult/Vertigo/Orderless how to not include (sub)path when finding a file?,False,
_Gink0_,28,42,2023-10-11 06:31:16,How do you quickly navigate inside a source file using emacs ?,False,
samuel1604,0,3,2023-10-11 02:48:51,[evil] Select in any kind of quote object,False,Question
varsderk,12,3,2023-10-10 16:29:29,Completion in Eat,False,
jvillasante,3,7,2023-10-10 15:59:56,emacs tree-sitter indentation,False,
Far-Anywhere2876,3,2,2023-10-10 15:56:44,Any way to distinguish normal example blocks from org babel results?,False,
larrasket,2,0,2023-10-10 14:10:57,Anyway to bind `centaur-tabs-do-close`?,False,Question
XaoGao,0,6,2023-10-10 12:46:10,Crash packages after updates,False,
Antique_Ad_3749,5,9,2023-10-10 11:31:49,Nvim user And Beginner looking for advice from Long time emacs users . Any help / suggestions are appreciated,False,
Gallipo,41,89,2023-10-10 10:42:50,What would you make default?,False,
Unknown,0,13,2023-10-10 08:05:22,Magit hiccup : transient-setup: Suffix,False,Question
unixbhaskar,14,0,2023-10-09 22:58:42,Some helpful Xah Lee Selection Commands,False,emacs-fu
Far-Anywhere2876,7,3,2023-10-09 22:39:22,Any way to stop org mode from adding preceding commas from src blocks?,False,
jcdix,1,16,2023-10-09 22:38:25,How get emacs 29 built from source to recognize mu4e installed by apt,False,Question
armindarvish,25,5,2023-10-09 22:25:02,"Announcing consult-gh 2.0, now with async search",False,
Unknown,1,3,2023-10-09 20:08:21,Docker.el,False,
Electrical-Series146,7,2,2023-10-09 20:01:49,rookie question from emacs videos,False,Solved
potatowithascythe,6,2,2023-10-09 18:57:22,Org Headings appear with the markup but also with stars.,False,Question
AnythingBeneficial59,4,3,2023-10-09 17:00:52,[deadgrep] Excluding files with glob?,False,Question
celeritasCelery,43,16,2023-10-09 13:59:33,Text showdown: Gap Buffers vs Ropes,False,
fmou67,1,2,2023-10-09 13:42:50,fzf in emacs under windows: it does not work since calling /bin/sh instead of a windows shell,False,Question
telenieko,2,8,2023-10-09 13:34:33,Scheduled e-mail sending,False,
Lin64_cd,3,2,2023-10-09 10:48:43,xwidget-webkit and wayland,False,
tenmajr,18,0,2023-10-09 07:09:01,My first post sharing my org agenda view setup,False,
tonyaldon,21,5,2023-10-09 06:48:41,How to write tests in Emacs Lisp?,False,
gogo-bog,3,4,2023-10-08 22:18:54,How to find buffer by path?,False,Question
unduly-noted,49,16,2023-10-08 20:39:55,I found a cool solution to a simple problem and I'm proud,False,
_commitment,2,7,2023-10-08 20:05:38,How to debug this type of errors?,False,
gmlarumbe,45,4,2023-10-08 18:58:36,fpga.el - FPGA & ASIC Utils for Emacs,False,
ElfOfPi,2,2,2023-10-08 17:50:02,How does one plot a horizontal bar chart with Emacs org mode tables?,False,Question
arthurno1,6,7,2023-10-08 14:58:55,Org-capture via completing read instead of read-key,False,emacs-fu
stevemolitor,3,1,2023-10-08 13:41:35,Variable Weight Fonts,False,
AkibAzmain,62,31,2023-10-08 10:01:56,Eat 0.9 released! 🎉,False,Announcement
CountMoosuch,5,0,2023-10-08 09:35:27,Supporting electric plugins for custom major mode,False,Question
ziplyx,25,63,2023-10-08 09:22:23,Doom or Spacemacs?,False,
NextTimeJim,5,9,2023-10-08 07:46:49,Anyone working on an org to typst exporter?,False,Question
AnythingBeneficial59,8,10,2023-10-08 06:21:51,How to remove `$` in the fringes on terminal emacs?,False,
pr09eek,5,8,2023-10-08 04:51:16,elpaca-log buffer doesn't disappear automatically.,False,
buhtz,2,7,2023-10-07 14:23:18,Improve Python code folding,False,
Velascu,26,59,2023-10-07 13:02:55,Vim user trying to understand more of emacs,False,
xenodium,13,1,2023-10-07 10:55:19,Trimming video screenshot from Emacs (feat. eshell in TRON legacy),False,
unduly-noted,2,18,2023-10-07 04:22:17,Top and bottom padding/margin?,False,
Hammar_Morty,190,27,2023-10-07 02:37:43,Showcase of my org-agenda /break-mode integrated into my system bar.,False,
Far-Anywhere2876,2,7,2023-10-06 21:19:42,How to make org mode only fontify subscripts/superscripts if there are brackets?,False,
geospeck,72,9,2023-10-06 19:56:31,EmacsConf - 2023 Talks,False,
codethrasher,1,1,2023-10-06 17:19:22,Projectile and an NPM-based Monorepo,False,Question
Coolrule360,3,0,2023-10-06 16:25:41,How to get dired like file permissions in marginalia.el,False,
BigWinnz101,7,4,2023-10-06 16:02:48,"Way to Make I-search ""own"" the cursor.",False,Solved
HisDufusness,3,1,2023-10-06 16:02:20,Help setup ZNC bouncer with ERC,False,Question
JohnDoe365,1,6,2023-10-06 11:54:25,Share you wisdom - how do you make indented lists in markdown-mode?,False,Question
xenodium,35,2,2023-10-06 11:16:10,Displaying basic image info in mode line,False,
SeanHaz,3,1,2023-10-06 09:39:27,"use-package-chords feel slow, is there anything I can do to remedy it?",False,
unixbhaskar,12,1,2023-10-06 09:31:02,"The Emacs ""selected"" package by Erik Sjöstrand",False,emacs-fu
mnjarogt,7,10,2023-10-06 08:05:57,Need help finding this theme,False,
Izder456,39,18,2023-10-06 00:42:56,Finally gotten around to documenting my code in org-mode,False,
Far-Anywhere2876,4,0,2023-10-05 21:54:23,Need help fixing indentation for keywords in org-modern,False,
theeJoker11,2,2,2023-10-05 21:04:00,Question regarding use-package and evil mode,False,
jflatow,15,7,2023-10-05 20:37:53,New package: vzi.el - Pipe data from emacs to the browser (and visualize it),False,
jakejxdev,20,13,2023-10-05 20:26:22,Workflow for reviewing code in Emacs?,False,
SlowValue,5,4,2023-10-05 19:27:27,"""generating"" statistical data of org table columns with table formulas (a tip and questions)",False,
waterstrider123,3,10,2023-10-05 18:22:47,Emacs tailored AI chatbot?,False,Question
aadcg,5,0,2023-10-05 18:01:40,The role of keyboard design in advanced shell programs,False,
SS4L1234,3,0,2023-10-05 17:46:51,dired-sidebar-toggle-sidebar error,False,
sebhoagie,10,6,2023-10-05 16:56:06,New package: cdsync - CalDAV support for Dairy/Calendar,False,Announcement
openbsdquestions,12,6,2023-10-05 16:53:06,Icons cut in half in terminal mode with doom-modeline,False,
Ornery_Trick8179,9,7,2023-10-05 15:34:04,Emacs python mode weird indentation,False,Solved
graduale,3,2,2023-10-05 15:17:36,Error in docstring for `completing-read-multiple`?,False,Question
WorldsEndless,4,2,2023-10-05 11:49:44,How to see a different day's view as if today in orgmode agendaZ,False,Question
k00rosh,1,0,2023-10-05 11:37:06,timezone issue with emacs installed via guix,False,Solved
whudwl,1,3,2023-10-05 10:58:48,Inconsistent forward-char behavior when there is image?,False,Question
mr_looser17,50,182,2023-10-05 04:09:02,Is switching to Emacs really worth it?,False,Question
arylcyclohexylameme,4,7,2023-10-04 22:28:58,Using org files as executables with argument parsing?,False,Question
Disastrous_Living845,1,2,2023-10-04 19:40:56,"Eshell tab completion while doing ""cd /ssh:"" and sudo",False,
OptimusCrime73,2,0,2023-10-04 17:57:46,Org Jupyter is not working,False,
dwrz,4,8,2023-10-04 15:26:44,Automatically adjust font size to fit fill-column,False,
hvis,74,15,2023-10-04 15:02:51,Company 0.10.0 is out,False,
littlesisterrun,14,4,2023-10-04 12:04:05,New package: git-cliff.el to generate and update changelog with git-cliff,False,Announcement
