Author,Upvotes,Comments,Created_At,Title,NSFW,Post_Flair
argsmatter,1,6,2023-11-23 17:16:18,"How to only install nerd fonts, when needed",False,
Clandestine17,2,2,2023-11-23 15:29:15,Modern Windows Emacs Dired Context Menu Helper?,False,
absolute_dumbass,32,38,2023-11-23 13:26:33,"Does anyone run Emacs with wsl2? I've noticed that fonts are quite a bit less crisp than they could be. On the left is running Emacs on a native terminal, on the right is the gui application.",False,
akuszyk,13,8,2023-11-23 12:48:02,Visualising data analysis in org-mode,False,
atamariya,11,0,2023-11-23 10:33:28,One-click Social Media Client - Youtube,False,
thephatmaster,5,14,2023-11-23 06:34:34,Are links without spaces just a doom thing? They're driving me potty!,False,Question
Psionikus,6,0,2023-11-23 02:14:33,I made some updates to Keypression and Command Log,False,News
vfclists,5,9,2023-11-23 01:13:19,How can swiper or some other search be restricted to a range of columns in a buffer?,False,
Fate_sc,28,47,2023-11-22 21:22:24,How rewarding learning Elisp can be?,False,
xenodium,8,0,2023-11-22 20:39:22,Want to try an org-backed journaling iOS app? DM me an email address for TestFlight invite.,False,
materus,3,5,2023-11-22 19:52:52,Emacs slow to open file if autosave exists,False,
metanote-team,18,2,2023-11-22 14:33:31,Metanote: Fully supports Org mode custom agenda view now!,False,
Unfair_Rice_3347,3,14,2023-11-22 13:18:38,How can I save the result of a ripgrep search,False,
domsch1988,6,18,2023-11-22 09:50:36,"What to use for ""Context Management""?",False,Question
Far-Anywhere2876,2,1,2023-11-22 09:17:50,Emacs 29.1 Org 9.7 Issues with Auctex,False,
unhammer,31,22,2023-11-22 09:13:42,"Overcolorization (""Everything is purple"")",False,
AutoModerator,7,30,2023-11-22 08:15:08,"Weekly Tips, Tricks, &c. Thread",False,
CatUnderOak,0,1,2023-11-22 07:37:04,load-path setting doesn't work,False,
daddyc00l,3,9,2023-11-22 03:30:26,Vertico Configuration And Directories With A '.git' Suffix,False,
Mamonimoni,0,10,2023-11-22 02:34:31,Is it possible to grab Mail.app desktop links in org and then open them in the iOS app?,False,Question
vfclists,5,4,2023-11-22 00:55:17,Is there some kind of completing-read-multiple command that allows enables selecting without filtering like the Ctrl-Space used in helm-mini?,False,
field_thought_slight,1,4,2023-11-22 00:47:41,Why does pop-to-buffer break save-excursion?,False,
MagosTychoides,29,26,2023-11-21 23:02:06,"I tried neovim and helix, and finally vim-likes are becoming more emacs-like",False,
melonakos,0,6,2023-11-21 22:28:32,Talk to Emacs with a GPT4 Co-Worker,False,
aaronaddleman,0,2,2023-11-21 21:55:31,"eMacs, docker, and Python packages",False,
zamansky,23,3,2023-11-21 20:12:38,Learning Elisp episode 14 - a minor mode,False,
goofansu,9,4,2023-11-21 04:03:49,How can I make embark-act respect the selected file's own directory instead of the default-directory?,False,
MailRegular8914,32,58,2023-11-20 23:28:31,"How can I become a more ""proficient"" Emacs user? Esp. in regards to developing",False,
Wood_Work16666,2,2,2023-11-20 16:28:21,What is the proper way to set East Asia font preference?,False,
DOMINATORLORD9872,2,2,2023-11-20 14:26:46,"[Eglot] JSON RPC Connection Error 32603 ""Internal Error""",False,Question
vanniuner,0,0,2023-11-20 14:26:22,neo emacs for beginners,False,
saarin,5,87,2023-11-20 13:21:57,Is the lack of multithreading support in emacs a dealbreaker for you?,False,
BustyBubby,2,0,2023-11-20 12:16:27,Transparency for Doom Emacs 29.1 on Windows?,False,
field_thought_slight,19,10,2023-11-20 11:05:19,org-roam: Automatically log modified nodes in daily note,False,
SlowValue,3,3,2023-11-20 09:57:31,"Request for help fixing a font display issue with Emacs 29.1, X11",False,Question
unixbhaskar,10,1,2023-11-20 02:02:12,Defalias: a quick guide to making an alias in Emacs,False,emacs-fu
Blackthorn,5,10,2023-11-20 02:01:09,A not-so-simple function and keybinding for querying the user during keyboard macros,False,emacs-fu
Public_Possibility_5,14,26,2023-11-19 21:00:45,Logseq equivalent for Emacs?,False,
schwanzuslongus23,18,10,2023-11-19 19:18:44,Using Dired with only one hand (for browsing dired and files while relaxing) Super cool.,False,
vfclists,7,10,2023-11-19 12:23:20,"Project grep search with folded results, navigable file preview, search term and results window retention?",False,
magthe0,23,23,2023-11-19 08:22:00,Making Emacs without terminal emulator a little more usable,False,
SS4L1234,0,12,2023-11-18 21:49:43,C mode indentation weird,False,
renzmann,73,2,2023-11-18 19:28:31,I'm bumping `treesit-auto` to v1.0,False,
Commercial_Repeat_59,2,1,2023-11-18 19:26:30,Dashboard directory,False,Question
geospeck,50,11,2023-11-18 18:06:38,Emacs: ediff basics,False,
Schroedinger50PCT,3,0,2023-11-18 16:56:55,Virtual keyboard for emacs?,False,
camber-weaver,5,12,2023-11-18 16:52:54,Advice from elisp hackers on improvemenets to tuedachu/ytdl?,False,
NGB_UF,3,2,2023-11-18 16:39:14,Enter key not working as expected on a new PC,False,
partyhesitancy,1,0,2023-11-18 15:01:23,Running flutter run from a terminal doesn't enable hot reload on save,False,
txgvnn,25,4,2023-11-18 13:19:07,project-tasks: Efficient task management for your projects by using org-babel.,False,Announcement
mklsls,1,1,2023-11-18 13:15:15,How to disable corfu only when `lsp-bride-mode` is active?,False,Question
ivano_GiovSiciliano,13,42,2023-11-18 11:48:20,emacs org for brainstorming is not optimal,False,
fragbot2,6,7,2023-11-18 01:14:13,Iterating through a data structure doing interactive edits on each element,False,emacs-fu
agumonkey,7,3,2023-11-18 01:03:21,"Eoops: an object-oriented programming system for Emacs-Lisp: ACM SIGPLAN Lisp Pointers: Vol V, No 3",False,
bradmont,1,10,2023-11-17 19:41:27,Does anyone have a workflow for quickly adding todos to org mode from a web-mail interface like gmail or proton?,False,
Glittering_Boot_3612,0,4,2023-11-17 19:32:37,why is SPC-c c for compiling and SPC-c C for recompiling? [DOOM EMACS],False,Question
larrygwapnitsky,8,5,2023-11-17 16:49:44,emacs on android,False,
ColaOChicken,19,2,2023-11-17 15:17:50,Emacs Workspace: IDE + Yet Another Jupyter,False,
debordian,3,12,2023-11-17 14:19:24,"GitHub - emacs-ng/emacs-ng: A new approach to Emacs - Including TypeScript, Threading, Async I/O, and WebRender.",False,
paarulakan,3,1,2023-11-17 10:24:19,TRAMP to edit files inside LXC container not working.,False,
paarulakan,3,1,2023-11-17 06:26:21,⛔ Warning (with-editor): Cannot determine a suitable Emacsclient,False,
Simulr,4,9,2023-11-17 00:07:41,No org-babel-execute function for grep!,False,
balloneij,18,6,2023-11-16 21:35:04,selection-highlight-mode - A minor mode for highlighting matches to the selection (inspired by VS Code),False,Announcement
Snoo-59698,25,4,2023-11-16 20:48:35,"Debug multi threaded Python apps with Emacs, eglot and dape",False,
neupermichael,49,28,2023-11-16 19:29:24,My LaTeX setup with emacs,False,
aqjo,2,0,2023-11-16 17:56:47,"(error ""Selecting deleted buffer"") working with an org buffer with an effort table",False,
sen-san,2,10,2023-11-16 17:19:06,adding MELPA package archive,False,Question
LightningSNTz55,104,63,2023-11-16 15:20:17,I love emacs,False,
fmou67,0,2,2023-11-16 11:58:37,How to modify the default folder shown by org-attach,False,Question
wybryk-ananasa,3,12,2023-11-16 11:24:45,How do I speed up output from an async-shell-command or start-process?,False,
doolio_,2,3,2023-11-16 10:51:01,Point jumps to start of buffer after save when there are changes to save,False,Solved
magthe0,8,13,2023-11-16 07:03:33,Using the golang mode shipped with Emacs,False,
grom358,7,10,2023-11-16 03:01:47,Note taking,False,
ruby_on_rawrls,16,8,2023-11-15 23:37:36,What do these characters in the describe-function completion minibuffer mean?,False,
Qubytes,118,21,2023-11-15 18:53:16,Needed this so bad,False,
reliableops,0,2,2023-11-15 17:24:01,Customizing imenu to select the current function under the cursor by default,False,
ragnese,26,79,2023-11-15 16:33:48,"Does anyone else feel like use-package might be the wrong abstraction, or do I just not get it?",False,
remillard,3,12,2023-11-15 13:29:13,Long Document Navigation (bookmarks? folding?),False,
olymk2,1,1,2023-11-15 13:04:28,golang templ mode ?,False,
Complex_Outcome697,16,2,2023-11-15 11:26:09,EMT - Emacs MacOS Tokenizer for enhanced CJK word operations,False,
thephatmaster,255,71,2023-11-15 09:41:13,Just for fun: roast my work / play setup,False,
zsome,2,8,2023-11-15 09:38:16,Better cua-mode,False,
vfclists,2,1,2023-11-15 08:47:35,Is the SQLite library developed for Emacs 29 are available for Emacs 28 or 27 through the compatibility layer?,False,
AutoModerator,7,30,2023-11-15 08:15:09,"Weekly Tips, Tricks, &c. Thread",False,
Freemason_1,1,11,2023-11-15 06:23:03,Better code autocompletion in Emacs?,False,
varsderk,5,16,2023-11-15 05:02:09,I have created an abomination,False,
blureglades,5,4,2023-11-15 02:23:29,haskell-mode error: Symbol's value as variable is void: flymake-allowed-file-name-masks,False,Question
jcubic,2,4,2023-11-14 21:41:27,My code to send raw keystrokes to ansi-term doesn't work with Emacs 29.1,False,
jsadusk,8,8,2023-11-14 19:38:08,Generic LSP server as a flymake/flycheck backend?,False,
vfclists,5,3,2023-11-14 17:37:29,How are circular function references and forward function declarations handled in emacs lisp?,False,
Ybenel,9,36,2023-11-14 15:02:44,Emacs natively on Wayland (PGTK) is slower than on Xwayland (Lucid) Also fonts are not looking good on both (but good on X).,False,
darkawower,254,62,2023-11-14 15:00:57,OrgNote - mobile app inspired by org-roam and org-roam-ui (early beta),False,Announcement
TiMueller,2,3,2023-11-14 14:09:47,goto-last-change doesn't work well,False,
lets-start-reading,2,4,2023-11-14 11:58:04,A consistent way to map `C-{lowercase}` and `C-{uppercase}`?,False,
dubcroster,29,32,2023-11-14 09:52:58,Frustrating python lsp experience,False,Question
blureglades,2,3,2023-11-14 00:05:28,How do improve code diagnostics in eglot?,False,Question
Ybenel,4,13,2023-11-13 23:12:15,Installing 2 Different builds of Emacs Version (29) (Attempt to fix fonts in Wayland),False,
Far-Anywhere2876,2,12,2023-11-13 21:53:08,Does anyone have a function they use to quickly copy org as markdown vice-versa?,False,
thephatmaster,2,2,2023-11-13 21:23:06,suggestions for synthwave theme?,False,Question
field_thought_slight,14,11,2023-11-13 20:15:00,Any way to make a variable save its old value?,False,
R3D3-1,4,3,2023-11-13 20:11:42,"Spurious ""unknown type"" compiler warnings in Emacs 29.1?",False,Question
thephatmaster,3,3,2023-11-13 16:51:36,Keep getting stuck with 2 fallback buffers,False,Question
R3D3-1,3,0,2023-11-13 15:41:16,Changed behavior of `format-spec' from 27.1 to 29.1,False,emacs-fu
xalixil,1,1,2023-11-13 14:53:34,Passing current file name to compile command,False,
R3D3-1,12,3,2023-11-13 09:33:42,Smarter line-breaking in visual-line-mode?,False,Question
JohnDoe365,2,2,2023-11-13 07:01:08,Emacs desktop option to NOT restore frame position and size,False,Question
amiralul,42,5,2023-11-13 06:58:32,Denote (denote.el) version 2.1.0 released!,False,News
chieftwit,3,2,2023-11-13 04:53:52,GPT Emacs Expert,False,
DurableOne,4,0,2023-11-13 03:33:04,Orgmunge 0.2.0 released,False,
paarulakan,4,7,2023-11-13 01:56:36,Extracting forums posts like reddit discussions into plaintext format like org,False,
No-Storage111,3,3,2023-11-12 20:32:22,How to apply different font for math fragments in org mode?,False,
sebasTEEan,46,16,2023-11-12 18:21:15,journalctl-mode v1.1,False,Announcement
Glittering_Boot_3612,0,3,2023-11-12 15:25:49,why does doom emacs side bar not render icons correctly ??,False,Question
vermiculus,26,14,2023-11-12 15:04:52,What are your favorite companion packages to eglot?,False,
igoryon,6,19,2023-11-12 11:15:14,built-in web server for the web project,False,
igoryon,2,5,2023-11-12 05:35:26,Opening resouces directly from source urls while performing web development,False,
Thaodan,2,11,2023-11-12 03:37:17,Package to manage Bookmarks inside Emacs,False,
xenodium,65,18,2023-11-12 00:35:21,"Not everyone's cup of tea, but this is now in chatgpt-shell (works on current buffer or dired selection)",False,
OverMilord,28,26,2023-11-11 19:38:51,Kickstart.emacs Starter kit for Gnu Emacs,False,Announcement
ProfessionalFamous86,2,3,2023-11-11 19:37:42,consult--line with C--w,False,Question
vfclists,2,7,2023-11-11 18:37:55,"What is the Emacs regex for matching a filename which contains periods, dashes and underscores?",False,
jsled,1,3,2023-11-11 17:54:50,Navigating the Linux Textscape using Vim and Emacs,False,News
BabySavesko,11,3,2023-11-11 16:29:47,Doom Emacs + DAP Mode: Anyone willing to share their config?,False,
JDRiverRun,9,8,2023-11-11 13:14:38,comint-fold: fold input + output blocks in Emacs shells,False,
Glittering_Boot_3612,6,13,2023-11-11 11:53:53,just started using emacs elisp guide for beginners?,False,Question
XCapitan_1,26,11,2023-11-11 10:36:51,Declarative filesystem management with Emacs & Org Mode,False,emacs-fu
vfclists,9,14,2023-11-11 05:42:01,consult-buffer results in screen with escape codes and whatnots,False,
jcubic,0,2,2023-11-10 21:06:42,ChatGPT tool inside GNU Emacs,False,
varsderk,15,27,2023-11-10 21:02:09,What do you use for searching?,False,
cruebob,4,11,2023-11-10 20:05:52,Green themes recommendation request,False,
TaijiKungFu,2,7,2023-11-10 19:53:14,EMacs on Mac opening two instances,False,
foodmonstereater,3,0,2023-11-10 18:31:10,racket-hash-lang-mode,False,Announcement
uneducated_guess_,1,4,2023-11-10 17:31:09,New Frame starts extremely small,False,Solved
jamescherti,6,0,2023-11-10 17:25:08,Converting code snippets from Ultisnips format to YASnippet format,False,
NGB_UF,3,4,2023-11-10 14:09:27,Having problems adding certain keybinds to Doom Emacs,False,
ph0t0nix,5,7,2023-11-10 11:24:41,Forge: no longer showing merge request numbers in Magit-log (since quite some time...),False,
TyrionBean,10,26,2023-11-10 09:55:25,Dired: How to move all files in subdirectories to directory above?,False,Question
nonamepew,9,15,2023-11-10 06:35:16,How to speed up Pyright + eglot.,False,Solved
grepkins,5,2,2023-11-10 06:08:04,"PlantUML, no ASCII in :results verbatim mode",False,
vfclists,1,1,2023-11-10 01:02:50,"How do I get ""C-x b"" in regular emacs to behave like it does in Doom, or like swiper-all in regular Emacs?",False,
jemadux,22,26,2023-11-09 23:32:33,i wanna try emacs,False,Question
varsderk,7,5,2023-11-09 21:39:36,Is there a Vim port of Denote?,False,
xalixil,16,15,2023-11-09 21:25:28,ripgrep and emacs,False,
bbroy4u,1,2,2023-11-09 20:38:31,is there any equivalent of highlight-undo.nvim in emacs?,False,
aviikc,5,7,2023-11-09 16:29:21,Using zoxide inside eshell.,False,
fz0x1,25,34,2023-11-09 16:14:36,Emacs as a replacement tmux,False,Question
justplanechad,1,3,2023-11-09 15:55:50,Issues with following links in Gnu Hyperbole,False,
g06lin,3,4,2023-11-09 15:14:17,Hiding org agenda files from buffer list,False,
graduale,2,3,2023-11-09 14:59:13,Struggling with setting a value for `outline-regexp`,False,
AbstProcDo,2,5,2023-11-09 07:41:09,Symbol Display Issue for Partly Cloudy Weather⛅️,False,Question
fmou67,2,3,2023-11-09 07:14:53,how to change the layout of the minibuffer,False,Question
larrasket,6,7,2023-11-09 06:02:23,How to detect unused includes in C source code?,False,Question
fz0x1,11,10,2023-11-09 04:38:28,How to use doom emacs w/o evil-mode?,False,Question
CatUnderOak,3,2,2023-11-09 03:05:43,org-mode issues: org-agenda-files don't work,False,
ladyn_,20,15,2023-11-08 19:19:46,anyone know how to fix the UI on doom emacs? the symbols don't show up correctly,False,
paarulakan,3,1,2023-11-08 19:03:40,Fedwiki org-roam integration,False,
fredy,0,1,2023-11-08 17:52:02,limited theme colors over ssh connection,False,
zamansky,4,0,2023-11-08 16:38:51,Learning elisp -text properties,False,
olivuser,1,0,2023-11-08 16:11:07,Desktop save versus darkroom-mode: darkroom-mode applied a second time when using desktop-read with buffers that already have darkroom-mode activated,False,
yottanami,2,2,2023-11-08 16:02:10,Exwm error: cl-no-applicable-method xcb:-+request,False,Question
ondrej-p,13,12,2023-11-08 14:37:45,Eat Background Color,False,
amiralul,3,5,2023-11-08 11:10:25,org-transclusion and denote,False,Question
thephatmaster,0,4,2023-11-08 09:38:45,Emacs (distrobox) won't launch after reboot - any tips for debugging?,False,
JohnDoe365,1,4,2023-11-08 09:22:14,"Grep, link to source and outline overview",False,Question
AutoModerator,12,17,2023-11-08 08:15:07,"Weekly Tips, Tricks, &c. Thread",False,
No_Fondant_4762,2,0,2023-11-08 01:04:59,perspective-el - duplicate workspace indicators in each visible window,False,
Patient_Chance_3795,2,0,2023-11-07 22:56:07,"python-shell-completion-complete-or-indent (Tab, in an inferior python mode shell) completes ""__PYTHON_EL_eval_file""",False,
xenodium,139,25,2023-11-07 19:30:52,When keyboard macros do the work for ya,False,
Patient_Chance_3795,4,7,2023-11-07 12:25:16,Folding in comint-mode,False,
unixbhaskar,3,0,2023-11-07 11:46:33,Install Emacs on Chrome OS Flex,False,emacs-fu
rayslava,2,1,2023-11-07 09:44:19,Emacs 29 GNUS font faces issue,False,
magthe0,2,4,2023-11-07 08:07:44,Copy-pasting from Emacs to Chrome-based browsers breaks unicode (I think),False,
ylluminate,1,14,2023-11-07 06:58:45,How to make emacs on macOS behave more like TextMate in terms of keybindings and opening/closing desktop (workspace)?,False,Question
hvis,27,6,2023-11-07 01:29:30,company-mode popup now working better with non-monospaced chars,False,
graduale,2,6,2023-11-06 22:26:54,What determines the appearance of the `help-for-help` buffer?,False,Question
Commercial_Turn1346,0,9,2023-11-06 20:35:32,Magit Commit Error,False,
FlamePhysics,2,4,2023-11-06 20:23:49,Emacs spell check without mouse while in LaTeX help.,False,Solved
Waeningrobert,12,45,2023-11-06 17:55:13,How do you sync your dotfiles and the files that you edit?,False,Question
tanrax,3,11,2023-11-06 17:51:07,"I have a problem with Magit when I make a commit: ""Waiting for your editor to close the file.""",False,
Emakstown,2,7,2023-11-06 15:44:40,Overwrite mode is not working with Korean characters.,False,
Psionikus,21,12,2023-11-06 13:39:46,Elisp Repo Kit demonstration,False,Announcement
buhtz,5,5,2023-11-06 11:02:01,Python / eglot: Detect naming typos in functions,False,
fmou67,2,10,2023-11-06 08:38:28,How to work with a list of files in a Dired buffer (org-agenda-files),False,Question
thephatmaster,99,31,2023-11-05 21:35:31,Finally got emacs installed on my steamdeck,False,Solved
llemaitre19,28,9,2023-11-05 21:17:48,jtsx - New package extending Emacs JSX/TSX built-in support,False,Announcement
cljnewbie2019,10,5,2023-11-05 21:06:16,Moving from Doom to Vanilla Emacs - consult-buffer,False,
MitsHaruko,1,2,2023-11-05 18:24:50,"cdlatex, parenthesis autopair and other autopairing modes",False,Question
slk_g500,8,10,2023-11-05 18:16:45,Using org-mode as an SQL playground - error lsp-org,False,
jvillasante,4,10,2023-11-05 15:36:16,Password store clear clipboard,False,
ltopast,7,10,2023-11-05 12:28:05,Is there a way to pin items in the M-x menu?,False,
juicecelery,0,1,2023-11-05 09:56:12,Is the callback to (xwidget-webkit-execute-script) ever triggered?,False,
lu2idreams,2,3,2023-11-05 09:49:58,[GNOME/Wayland] Emacs dark title bar,False,
Thf_killer,13,18,2023-11-05 08:38:53,How usable is Emacs + logseq currently?,False,
External-Spirited,1,5,2023-11-05 06:06:50,Use Gmail atom feeds in Elfeed,False,Question
meedstrom,10,0,2023-11-04 23:51:01,"New package: massmapper! Bind lots of new default keys, e.g. prepopulate Super with everything that was under Ctl-Meta",False,Announcement
objective_porpoise,3,3,2023-11-04 22:27:50,Problem making overlays invisible,False,Solved
desquared,14,12,2023-11-04 21:23:52,"emacs package or command to show a ""tip/trick of the day""?",False,
thephatmaster,0,1,2023-11-04 21:10:51,Need help with final install hurdle - doom sync,False,Question
Calm-Bass-4740,4,3,2023-11-04 15:29:27,Latin small caps in Emacs,False,
JoeKazama,91,31,2023-11-04 13:02:20,Shout out to the eat terminal emulator package,False,emacs-fu
Ok_Cartoonist_8730,0,15,2023-11-04 12:15:25,Theme suggestion request,False,
summeremacs,2,3,2023-11-04 09:15:22,Bluesky Emacs Client?,False,Question
centzon400,18,8,2023-11-04 08:30:58,[history] Understanding the origins and the evolution of Vi and Vim,False,
vfclists,2,3,2023-11-04 01:22:27,Are these cell references in this org-table spreadsheet formulae valid?,False,
geospeck,64,26,2023-11-03 22:44:49,You don't need a terminal emulator,False,
eis3nheim,2,0,2023-11-03 20:54:26,How to configure Arduino LSP?,False,Question
aghull,3,3,2023-11-03 20:00:32,company mode replacement behaviour when point in middle of word,False,Question
paarulakan,3,7,2023-11-03 18:28:31,^[7 ^[8 characters appear inside emacs *shell*. How to avoid them?,False,
BullCityPicker,2,10,2023-11-03 15:20:08,How do I specify a Language Interpreter (R in ESS-Emacs),False,
ReneFroger,4,1,2023-11-03 14:13:39,[Package of the day] Loophole - set temporarily keybindings,False,
arthurno1,20,3,2023-11-03 12:13:27,Algorithmic Composition: A Gentle Introduction to Music Composition Using Common LISP and Common Music,False,
AbstProcDo,12,6,2023-11-03 11:11:51,"Accepting of the omnipresent of ""faces"" as ""font"" and ""typeface"" are interchangeable",False,
fmou67,2,0,2023-11-03 10:17:00,"filetags vs regular tags and org-roam note-taking: can tags be ""context"" dependant or is there a way to create new kinds of tags?",False,Question
rileyrgham,2,5,2023-11-03 09:20:03,"BMKP, BookMarkPlus - changing bookmark paths : errors",False,
g06lin,4,5,2023-11-03 03:09:08,buffer-face-mode everywhere,False,
tuhdo,24,7,2023-11-02 17:32:02,[Guide] Setup NANO Emacs theme properly on Windows (Screenshots inside),False,emacs-fu
JoukeHijlkema,33,3,2023-11-02 15:45:08,Create flowcharts with org-mode,False,
summeremacs,5,19,2023-11-02 15:18:05,Use consult (maybe bookmarks?) in dired minibuffer browsing to other directory?,False,Question
fmou67,9,5,2023-11-02 13:18:35,Any package to inform about emacs bindings when evil bindings are used,False,
paarulakan,5,7,2023-11-02 12:36:54,Hashing a pdf and other files in emacs-lisp,False,
olymk2,0,2,2023-11-02 09:03:37,eval-expression Can't eval elisp code with enter,False,
CompetitiveToe4462,1,2,2023-11-02 08:53:39,Doom Emacs: delete multiple spaces by a single <Backspace> (reverse tab-like behavior),False,
hunt_for_highprotein,12,2,2023-11-02 06:19:33,"Any Easy way to setup protonmail, (send ,receive mail) using emacs?",False,
paarulakan,2,3,2023-11-02 06:01:51,bongo + mpv - error in process filter: JSON readtable error: 115,False,Question
rileyrgham,4,0,2023-11-01 11:27:15,LSP project import not sticky,False,
thephatmaster,6,3,2023-11-01 09:06:32,Steamdeck install (flatpack?),False,Question
AutoModerator,13,5,2023-11-01 08:15:07,"Weekly Tips, Tricks, &c. Thread",False,
CompetitiveToe4462,1,3,2023-11-01 08:01:18,Doom Emacs: delete a word using <Right Option>+<Backspace>,False,
hunt_for_highprotein,5,8,2023-11-01 07:24:49,How to use whatsapp / facebook messenger through emacs?,False,
Kwisacks,52,12,2023-11-01 06:52:12,Nice and entertaining Emacs praise video. Link points to when he starts talking about emacs and neovim.,False,
Mahir1210,11,1,2023-11-01 03:09:51,How to change neotree icons,False,Question
B_A_Skeptic,0,19,2023-10-31 22:59:52,How to have a file manager appear on the side when I open emacs?,False,Question
SirNatzgun,2,0,2023-10-31 22:45:36,"Folder icon not showing in ""neotree"" file manager.",False,
B_A_Skeptic,7,3,2023-10-31 22:04:49,Is it possible to output logs from your init.el file?,False,Question
EKFLF,14,10,2023-10-31 18:08:16,"Why I can't type lowercase ""q"" after LSP started [more in comments]",False,Solved
TyrionBean,6,11,2023-10-31 06:31:43,FreshRSS and Elfeed?,False,Question
brittAnderson,3,8,2023-10-31 17:16:23,Trying to use mu search in gnus and failing,False,
maxkool,3,3,2023-10-31 12:04:42,Emacs on WSL Home directory: How to use the same config and packages as Windows Emacs,False,
AbstProcDo,12,2,2023-10-31 08:15:30,How display SVG images with a Light background while using dark-theme in org mode,False,
rorrryyyy,13,15,2023-10-31 06:09:04,How to version control elpa directory to work in both linux and windows?,False,
Desperate_Donut_7527,10,6,2023-10-31 00:55:20,Better spacing and folding in org-mode?,False,Question
JuanitoPollito,9,14,2023-10-30 23:57:38,Mac users be wary of macOS 14 Sonoma,False,
cloudyearnings,6,15,2023-10-30 23:17:02,M-: (AKA M-x eval-expression) does nothing upon hitting RET. What could cause this?,False,Question
Restitutionshot,2,2,2023-10-30 23:13:28,company completion not working in find-file,False,Solved
jmjones5,6,11,2023-10-30 21:30:31,Autosave package code review?,False,
zamansky,24,0,2023-10-30 17:55:59,Learning Elisp part 12 - using hooks,False,
g06lin,3,7,2023-10-30 16:18:31,Opening org-agenda takes up the entire frame,False,
Mamonimoni,1,0,2023-10-30 15:21:23,Automatic filtering of newsletters in mu4e?,False,Question
larrasket,23,58,2023-10-30 12:03:03,Share how did you make Emacs faster.,False,emacs-fu
tms9918,8,5,2023-10-30 07:41:02,Periodically run an external program and show notifications in the mode line,False,
unixbhaskar,13,2,2023-10-30 05:49:49,The conception and depiction of lines in Emacs (Advanced Topic),False,emacs-fu
summeremacs,4,6,2023-10-30 05:13:57,Copy Photos/Images to MacOS Photos app?,False,
StrangeAstronomer,5,4,2023-10-29 22:38:52,emacs on chromebooks,False,
AnalystOrDeveloper,0,21,2023-10-29 18:16:47,Does Emacs Support Parallel Processing in a Juypter Notebook Equivalent Environment?,False,Question
_poly102,12,16,2023-10-29 15:07:15,Lsp,False,Question
brandelune,2,3,2023-10-29 14:20:22,Weird error with zotxt,False,Question
