Author,Upvotes,Comments,Created_At,Title,NSFW,Post_Flair
mkerrigan,2,2,2023-12-16 23:59:55,Coming up with a way to strip date suffixes,False,
Unknown,7,36,2023-12-16 21:53:03,How do you use Emacs on Windows 11?,False,Question
vfclists,2,2,2023-12-16 21:45:37,How can I stop the embark-act notifications constantly resizing the minibuffer?,False,
rileyrgham,1,2,2023-12-16 18:37:12,desktop-save-mode and server/daemon,False,
waterstrider123,3,13,2023-12-16 15:45:43,Random pauses while moving around in Emacs,False,Question
MrMelankoli,3,2,2023-12-16 15:31:30,html-ts-mode?,False,
eminent101,1,1,2023-12-16 11:17:02,How can I make mhtml-mode highlight complete JavaScript or CSS code present in a .html file?,False,Question
lets-start-reading,0,44,2023-12-16 10:38:48,"""Antiquated"" systems break usability",False,
vfclists,0,8,2023-12-16 08:49:41,"At over 1 megabyte is my ""history"" file too big? Informal poll - how big is your history file?",False,Question
littlesisterrun,6,17,2023-12-16 08:22:37,Help: how to edit non-continuous lines like 3-6L and 7-13L at the same time?,False,Question
murky_watr,21,6,2023-12-16 05:28:58,How to do I remove this top bar?,False,Question
Melodic_Security_225,4,6,2023-12-16 05:07:13,Evil mode + exwm,False,Question
wedontspeaksamelang,1,4,2023-12-16 02:18:41,How can I get all list of property key like tag?,False,
cidra_,1,2,2023-12-15 22:52:18,#!/usr/bin/emacs -x doesn't appear to work in Termux,False,
HerissonMignion,0,10,2023-12-15 19:48:30,"Learning Emacs, need help undertanding imenu or ""goto definition"" (in programming), please.",False,Solved
paarulakan,25,67,2023-12-15 19:48:03,what are some drawbacks of using literate emacs config?,False,
Far-Anywhere2876,2,3,2023-12-15 19:40:13,Need help getting SICP racket to work in org mode.,False,
yfhuang97,2,2,2023-12-15 18:05:07,Cannot enable LaTeX-math-mode in org-mode,False,
dezmondfinney,2,6,2023-12-15 14:20:42,emacs and termux,False,
unaboomer_2077,3,4,2023-12-15 14:06:48,Color of org header to org-ellipsis,False,
paarulakan,1,0,2023-12-15 12:46:41,"org-ref installation: (error ""Key sequence a r starts with non-prefix key a"")",False,
CatUnderOak,3,9,2023-12-15 10:27:23,A weird issue occur to EVIL mode,False,Solved
LeviLovie,37,19,2023-12-15 03:58:25,Using VIM inside Emacs' terminal,False,
Psionikus,23,15,2023-12-15 03:37:38,Emacs Speedrun Content,False,News
github-alphapapa,60,6,2023-12-15 02:44:56,"Emacs Advent Calendar, day 15: alphapapa's Emacs and Org-related packages",False,Announcement
waterstrider123,1,1,2023-12-14 23:01:35,Issues running EAF for Mac,False,Question
SnooPets20,1,3,2023-12-14 22:26:35,"Corfu's posframe sometimes gets stuck, how can I fix it?",False,Question
ottertino415,2,13,2023-12-14 19:10:13,Magit error when commiting,False,
broman243,6,3,2023-12-14 19:09:09,Using Telegram to interact with OrgMode,False,
gopar,76,43,2023-12-14 15:06:30,My Modern Emacs UI Setup,False,
piripicchi,1,2,2023-12-14 11:40:04,HyRolo personal file,False,
vfclists,5,6,2023-12-14 10:05:33,Who uses emacsql for storage for Lisp data and what are the experiences it?,False,
Tristan401,2,9,2023-12-14 09:38:21,"Best way to make CAPS be Hyper, and make CAPS+IJKL be same as arrow keys?",False,Question
1goodbyte,1,1,2023-12-14 09:37:24,"Not sure how to find the message trigger, csharp",False,Question
waterstrider123,3,9,2023-12-14 06:23:53,Programming workflow with emacs 29,False,Question
new2bay,7,3,2023-12-14 05:23:07,"Looking for good examples, especially for eieio",False,Question
atamariya,7,2,2023-12-14 05:22:19,EMMS Tag Editor,False,
JDRiverRun,42,17,2023-12-14 02:09:05,"Emacs Advent Calendar 14: indent-bars, kind-icon, org-modern-indent, and more",False,
barnaclesaretasty,3,2,2023-12-14 01:38:54,tree-sitter highlighting problems in org code blocks,False,
vfclists,1,0,2023-12-13 22:26:01,Is it possible to pre-select items on a helm list when it is displayed?,False,
MmmmmmmmmmmmDonuts,0,1,2023-12-13 19:50:56,Need Help with Configuring evil-set-leader locally,False,Question
osvarcha,2,5,2023-12-13 18:10:53,Tectonic + Termus for port Emacs Android,False,
osvarcha,2,0,2023-12-13 18:10:52,Tectonic + Termus for port Emacs Android,False,
ReneFroger,135,40,2023-12-13 12:32:48,Emacs' helm is maintained by one maintaner for 11 years long. His mistake to switch from Paetron made him to lose nearly all his contributors. Consider to donate again?,False,
Miss_Mizzy,70,18,2023-12-13 08:39:34,Comfy Wikipedia Reading Experience (eww + imenu-list + shrface),False,
AutoModerator,10,7,2023-12-13 08:15:07,"Weekly Tips, Tricks, &c. Thread",False,
Comprehensive_Mud645,8,16,2023-12-13 05:39:19,How to navigate to bottom bar,False,
Comprehensive_Mud645,8,7,2023-12-13 02:31:45,Migrating from Neovim,False,
waterstrider123,4,7,2023-12-13 02:23:05,Displaying fringes with modus-themes,False,Question
codethrasher,1,1,2023-12-12 23:35:11,Smerge: keep lower for entire file,False,Question
bbroy4u,6,8,2023-12-12 21:20:45,how to get inline results when pressing C-x C-e,False,
mikeegg1,0,9,2023-12-12 20:46:07,EMACS package?,False,Question
geospeck,19,2,2023-12-12 19:53:26,"Emacs: multilingual editing (Greek, French, Chinese, etc.)",False,
FalconEmbarrassed69,1,5,2023-12-12 18:51:57,Org 9.7 modify latex preview widths and jump over previews,False,
bbroy4u,6,27,2023-12-12 17:05:25,i wish emacs has smooth scroll and window animations like this,False,
bbroy4u,0,4,2023-12-12 16:49:41,is there any way to get similiar look in doom modeline,False,
Hercislife23,4,0,2023-12-12 16:24:27,GitLab Code Suggestions for Emacs,False,Question
Magiel,3,4,2023-12-12 15:33:07,Gnus: how to search (G G) a combined group (nnvirtual),False,Question
eternal-hobbyist,1,4,2023-12-12 15:21:45,How do I up my avy/hydra game?,False,
GroundbreakingAir462,1,0,2023-12-12 14:24:55,Org-table multi-line cells/cell-wrapping,False,
fast-90,2,9,2023-12-12 12:36:28,'org-element-at-point' cannot be used in non-Org buffer,False,
domsch1988,14,12,2023-12-12 11:28:48,Your Favorite/Most usefull Mode-Line Segments?,False,emacs-fu
Laugarhraun,3,3,2023-12-12 10:51:42,Confusion with emacs+slime+quicklisp: (require :some-package) working or not depending on how I evaluate the file,False,Question
External-Spirited,1,2,2023-12-12 09:50:04,Review-Requests empty in Pull request mode,False,
I3lind5pot,9,4,2023-12-12 09:19:29,Anyone going to 37c3 and up for a meet-up?,False,Question
Fluffy_Professor_639,2,5,2023-12-12 07:47:14,Images are grainy and too zoomed in in org 9.7,False,
Old_Cookie9743,6,18,2023-12-12 04:39:36,When should use-package :custom or setopt be used for setting user options?,False,
GeekSync,4,10,2023-12-12 01:44:18,How do I find completed tasks,False,Question
vfclists,1,5,2023-12-12 00:44:34,Is there a way to list all the known mode maps available to Emacs whether accessible or not?,False,Question
AndreaSomePostfix,3,0,2023-12-11 23:34:42,Make Emacs help in creating an example of Scala classes,False,
waterstrider123,0,0,2023-12-11 22:49:23,How to setup Bing AI in Emacs?,False,Question
ImportanceFit1412,3,10,2023-12-11 20:41:21,magit/git: Why do I need to reconcile divergent branches rather than just fix a conflict??,False,
josiahmattern,2,1,2023-12-11 20:33:40,Just installed org roam and am having a bit of a problem,False,
Davidbrcz,17,0,2023-12-11 20:19:33,New tree-sitter based major mode for TLA+ / PlusCal v0.1.0,False,
remillard,3,8,2023-12-11 14:59:50,pdf-tools in Windows,False,
Crimzennnn,1,0,2023-12-11 11:17:17,Change closed timestamp tag colours emacs org mode,False,
saarin,26,95,2023-12-11 10:32:00,Packages that you would like to be in emacs core ?,False,Question
waterstrider123,13,17,2023-12-11 04:22:45,Is there a way to center images in Org-mode or place two images side by side?,False,Question
MoistFew,21,3,2023-12-11 02:58:06,Major mode for Hurl,False,Announcement
PracticalViking,4,2,2023-12-10 23:09:24,web-mode vs js2-mode syntax highlighting and lsp-mode questions,False,Question
vfclists,0,32,2023-12-10 22:44:04,Do we have so many of these Silicon Valley types on this sub-reddit and HN?,False,
dm_g,3,7,2023-12-10 21:20:49,Is it possible to watch/browse the Emacs Conf from inside emacs?,False,
hands0m3dude,0,31,2023-12-10 19:38:15,"Recently, emacs has been a pain in the ass for me",False,
jackprotbringo,1,3,2023-12-10 18:20:42,Help needed with global-company-mode,False,
blueranger1981,15,5,2023-12-10 16:33:03,Elfeed + LLM,False,
geospeck,0,159,2023-12-10 15:13:27,"Bad NEWS, Emacs",False,
FederalStalker,0,25,2023-12-10 13:13:49,I know nothing about emacs. Ask me a question about it and I'll answer as if I do.,False,
vfclists,4,9,2023-12-10 12:47:57,"Is there a way to list out all the evil commands, their descriptions and their key shortcuts?",False,
Remote_Tap_7099,11,8,2023-12-10 06:09:08,"The Emacsen family, the design of an Emacs and the importance of Lisp",False,
ReneFroger,22,8,2023-12-09 23:10:19,Fuzzy Finding with Emacs Instead of fzf,False,
lounge-582,21,17,2023-12-09 22:37:56,STM (Software Transactional Memory) for Emacs/Elisp?,False,
nullpspace,1,6,2023-12-09 17:29:12,org-babel problem with gnuploy,False,
simplex5d,1,7,2023-12-09 14:34:08,Configure clangd in eglot to not add headers?,False,
astoff1,37,24,2023-12-09 11:33:05,"Emacs Advent Calendar 9: devdocs, code-cells, dREPL, etc.",False,
tereshkd,4,12,2023-12-09 10:30:17,Slow magit and async input,False,
bozhidarb,27,4,2023-12-09 10:29:12,super-save 0.4 is out with a bunch of new features!,False,
yantar92,28,19,2023-12-09 10:02:19,[Results] Please help collecting statistics to optimize Emacs GC defaults,False,
Moises95,29,4,2023-12-09 08:30:59,Emacs Advent Calendar 8: emacs-goodnight,False,Announcement
hasturhu,1,4,2023-12-09 02:10:34,Customize Doom Emacs packages?,False,Question
vsavchenko,51,9,2023-12-08 23:10:29,New Emacs macOS icon,False,
ltopast,46,20,2023-12-08 16:51:48,My Steam Deck EXWM setup,False,
vfclists,4,2,2023-12-08 15:27:47,Are there some regular expression libraries in some languages which enable the creation of named abbreviations?,False,
paarulakan,2,16,2023-12-08 14:03:32,should I use a non expiring gpg key for password stores like .authinfo?,False,
Phthalleon,4,2,2023-12-08 13:12:52,Lsp code error syntax highlighting,False,
oantolin,58,31,2023-12-08 07:02:03,"Emacs Advent Calendar 7: ordeless, embark 1.0 and some bric-a-brac",False,Announcement
github-alphapapa,10,0,2023-12-08 03:50:30,Release 1.3.1 · alphapapa/org-bookmark-heading,False,Announcement
graduale,6,2,2023-12-08 03:18:32,Forwarding HTML Emails in mu4e,False,Question
Rich_Ad_8001,1,4,2023-12-08 00:33:25,[evil mode] how to move lines up and down in visual mode?,False,
Deds0305,1,10,2023-12-07 23:32:01,Some icons are shown and some aren't,False,Question
mekeor,23,5,2023-12-07 23:04:42,Please contribute to Tree-Sitter based JavaScript and TypeScript Modes in GNU Emacs core,False,
nv-elisp,36,48,2023-12-07 21:41:27,How to Lock Yourself out of a GPG encrypted file with Emacs,False,
nullpspace,4,2,2023-12-07 15:10:28,Change linum-face color of modus-operandi-tinted,False,
vecksagos,2,3,2023-12-07 12:54:52,Debugging with dap-mode and launch.json,False,
realcarmen1678,0,5,2023-12-07 10:45:46,Org files in Google Drive,False,
Bluxmit,36,7,2023-12-07 09:02:36,Emacs code editor in browser. Link to the Dockerfile - https://github.com/bluxmit/alnoda-workspaces/tree/main/workspaces/emacs-workspace,False,
atamariya,10,0,2023-12-07 05:01:33,Stream ListenBrainz.org Music Playlist,False,
Several-Echidna3425,5,28,2023-12-07 01:40:20,Terminal or GUI app: On which do you use Emacs more?,False,
trimorphic,7,4,2023-12-07 01:17:46,How to display both relative and absolute line numbers at the same time?,False,
MinallWch,16,34,2023-12-06 19:04:14,Anyone using GNUS in 2023?,False,
bbroy4u,4,5,2023-12-06 17:11:50,journaling in orgmode datetree as alternative to different plugins.. need some help as well,False,Question
karthink,54,8,2023-12-06 16:54:37,"Emacs Advent Calendar 6: elfeed-tube, popper, consult-dir, gptel and more",False,Announcement
MulberryLeast4599,6,6,2023-12-06 16:35:08,Removing remote information from find-file,False,
linwaytin,3,0,2023-12-06 15:51:50,Reliable way to fold code blocks for julia,False,
vfclists,8,9,2023-12-06 13:16:32,"How can the Emacs interface be manipulated by an external script, preferably a REST API?",False,
vfclists,5,20,2023-12-06 10:19:33,Isn't it better to study Common Lisp before having a go at Elisp or learn them side by side?,False,
AutoModerator,10,5,2023-12-06 08:15:09,"Weekly Tips, Tricks, &c. Thread",False,
JohnDoe365,47,3,2023-12-06 07:47:23,GitHub - svaante/dape: Debug Adapter Protocol for Emacs,False,Announcement
Fluffy_Professor_639,0,5,2023-12-06 07:40:11,How can I use this config?,False,Question
amiralul,5,5,2023-12-06 07:11:45,Writable hyperdrives? (hypedrive.el question),False,Question
Amanas23,0,5,2023-12-06 02:25:27,"Switching to emacs, but the Gruvbox theme here looks different than in CLion or VIM",False,Question
macro__,1,3,2023-12-05 22:49:49,WSL Debian & Emacs is interpreting ALT has SUPER,False,
NotAnybodysName,4,3,2023-12-05 22:38:03,Fonts on Android,False,
Electrical-Series146,2,3,2023-12-05 21:11:43,emacs latex-mode question,False,Question
Piotr_Klibert,11,15,2023-12-05 21:00:25,Supercharge your eval-expression with ielm!,False,
ph0t0nix,5,3,2023-12-05 20:11:19,"Org-roam: find ""linkable"" text in node",False,
broken_symlink,4,7,2023-12-05 19:13:48,lsp-mode pylsp starting,False,Question
vfclists,6,2,2023-12-05 17:21:14,Emacs boffins guide to reprogramming keyboard for EXWM?,False,
Glad-Resolution-9140,6,1,2023-12-05 16:39:41,Use emacs tree-sitter to get the path of json element,False,
Massive-Squirrel-255,41,20,2023-12-05 16:35:13,More advanced emacs tutorials,False,
bci_,18,2,2023-12-05 14:38:47,Emacs Advent Calendar 5: Advent of Code Helper,False,
aqua0210,8,10,2023-12-05 10:37:16,What is the name of the nice light theme,False,Solved
MulberryLeast4599,4,3,2023-12-05 02:14:43,Removing compilation from vterm with use-package and elpaca,False,
Far-Anywhere2876,2,6,2023-12-05 01:35:49,Need help creating elisp function to import org table to sql database?,False,
introsp3ctor,8,1,2023-12-05 01:21:19,ollama refactor/reify large buffer into questions,False,emacs-fu
breathe-out,28,3,2023-12-05 00:31:26,Emacs Advent Calendar 4: chordpro-mode.el v2.2.0,False,Announcement
capenius,3,6,2023-12-04 20:04:38,`gnus-summary-expire-articles` behaves differently when invoked directly vs from hook,False,
danielkraj,10,13,2023-12-04 16:35:40,Has anyone managed to debug (DAP) python with a virtual environment activated?,False,
simplex5d,10,5,2023-12-04 15:59:31,Stupid doom-modeline question: what is to the left of the buffer icons and name?,False,
MinallWch,5,6,2023-12-04 14:39:28,Configuring SMTP Mail sending,False,
fmou67,4,0,2023-12-04 11:59:45,How to start a deadgrep from a virtual dired,False,Question
pthierry,3,6,2023-12-04 09:56:04,Lost several features in eglot,False,Question
timmymayes,1,3,2023-12-04 07:27:55,Any tutorials for Custom Agenda Functions?,False,
unixbhaskar,25,1,2023-12-04 04:00:47,The Essentials of Emacs Bookmarks,False,emacs-fu
Quirky-Indication670,1,2,2023-12-04 02:25:23,Emacs install with tree sitter,False,
DarlingEffect,9,6,2023-12-04 01:05:08,How to native-compile your init file,False,
shipley7701,3,6,2023-12-03 23:29:20,Narrow org headline search by properties,False,
github-alphapapa,53,11,2023-12-03 23:28:01,"EmacsConf 2023, day 2: Talks and conclusion",False,Announcement
Ok-Excitement6326,3,6,2023-12-03 22:28:21,Emacs TTY super+number inserts IO characters!,False,
Eckomute,3,10,2023-12-03 22:14:23,Having trouble installing packages using custom config and would appreciate any help,False,Solved
cynroach,2,5,2023-12-03 18:47:19,"Emacs vanilla error, no previous config.",False,
WuuBoLin,3,3,2023-12-03 11:32:37,Custom read-file-name-function from Vertico/Consult causes rfn-eshadow to stop working.,False,Question
Aiclys,38,52,2023-12-03 10:50:15,How to learn Emacs?,False,
tsengf,6,3,2023-12-03 07:55:05,Cycle Through Emacs Themes,False,
bbroy4u,1,4,2023-12-03 07:20:35,"need some help in emacs config (embark-export , how to set a variable )",False,Question
Remote_Tap_7099,40,3,2023-12-03 05:51:59,Crafting Ironsworn in Emacs,False,emacs-fu
breathe-out,33,16,2023-12-03 05:46:30,Emacs Advent Calendar: hyperdrive.el v0.3.0!,False,Announcement
kalosdaemon,21,2,2023-12-03 03:25:18,Howm: A forgotten gem for note-taking,False,
broken_symlink,2,5,2023-12-02 23:17:57,Theme not working on emacs 29.1.,False,Question
cottasteel,44,10,2023-12-02 22:49:48,Emacs Advent Calendar 2: Cyclekey - Quickly cycle through diacritics at point,False,Announcement
ghiste,1,1,2023-12-02 22:34:45,evil-want-minibuffer interferes with orgmode date picker,False,
github-alphapapa,32,9,2023-12-02 20:32:26,EmacsConf 2023: How I play TTRPGs in Emacs - Howard Abrams,False,emacs-fu
Kaptem,5,5,2023-12-02 20:21:55,Implement Apostrophe Hemingway mode,False,Question
marcin-ski,25,7,2023-12-02 18:53:02,Package alert: surround,False,
Eckomute,1,4,2023-12-02 16:36:37,Please help write a tangle code that will manage my init.el from a custom.org orgmode file stored on Dropbox.,False,Solved
arthurno1,28,23,2023-12-02 14:34:21,Advent of Code 2023 with Emacs Lisp — Day 2,False,
github-alphapapa,64,3,2023-12-02 13:00:45,"EmacsConf 2023, Day one: live in one hour!",False,Announcement
vfclists,1,3,2023-12-02 10:07:41,Forgotten how insert a function and variable name from `C-h`,False,
timmymayes,2,2,2023-12-01 23:42:24,Cursor won't leave the mini-buffer with C-g,False,
cynroach,7,5,2023-12-01 21:30:27,Emacs sometimes opens in a tiny window.,False,
timmymayes,5,1,2023-12-01 20:42:40,CALFW Recurring Events,False,
minad-emacs,160,18,2023-12-01 19:51:06,"Emacs Advent Calendar 1: Stable releases of Consult, Corfu, Cape, Vertico and more",False,Announcement
bitec0de,6,4,2023-12-01 17:55:16,Is it possible to prevent emacs from ever scrolling past the end of a buffer?,False,Question
BobKoss,6,6,2023-12-01 15:48:29,Buffer completions?,False,Solved
arthurno1,24,4,2023-12-01 15:23:47,Advent of Code Emacs Lisp — Day 1,False,
_Arzach_,4,1,2023-12-01 11:35:24,eshell X11 issue,False,
NotAnybodysName,8,13,2023-12-01 07:43:57,"X days from Easter - calendar, holidays, diary, org",False,Question
jackprotbringo,7,6,2023-12-01 05:23:22,Hit a wall trying to learn and feeling frustrated,False,Question
Zaeph,28,4,2023-11-30 22:43:07,EmacsConf joins Free Software Foundation fiscal sponsorship program,False,News
Eckomute,4,3,2023-11-30 20:31:53,Trying to use Orgmode to customise emacs and make custom named init file within Dropbox folder. It's been a long time since I used emacs and am foggy. A few questions.,False,Question
Inertialy,3,4,2023-11-30 19:17:57,Help Needed with Config!,False,
mn_malavida,1,0,2023-11-30 15:47:18,Colorblind white theme like Prot's (modus-operandi-deuteranopia) that works well with lsp-mode?,False,
MinallWch,6,13,2023-11-30 14:26:23,Anyone using devenv sh with Emacs?,False,
ZeStig2409,23,27,2023-11-30 14:04:51,Rate my setup,False,
domsch1988,102,20,2023-11-30 12:39:49,Finally getting somewhere,False,
arthurno1,2,7,2023-11-30 12:12:45,AoC Puzzle Skeleton Generator,False,emacs-fu
iwasjusttwittering,18,26,2023-11-30 12:03:00,Using Common Lisp in Emacs [LWN.net],False,
__EveryNameIsTaken,5,3,2023-11-30 10:22:14,dap mode for c++ not working,False,Question
KenranThePanda,5,4,2023-11-30 07:57:18,Naga theme: looking for feedback,False,
BBSnek,7,9,2023-11-30 07:19:11,Emacs fullscreen on M1 Mac - top line hidden by notch,False,Question
ManWhoTwistsAndTurns,4,14,2023-11-30 04:23:31,Make parenthesis lighter or slightly transparent,False,
JDRiverRun,27,13,2023-11-30 01:27:38,ultra-scroll-mac: high performance scrolling for emacs-mac,False,
liesdestroyer,2,5,2023-11-29 23:51:34,Auto-Automatic-Snippets (problem),False,
xenodium,53,30,2023-11-29 22:59:44,Build your own bookmark launcher,False,
WorldsEndless,11,11,2023-11-29 22:31:37,My EMMS Transient,False,
arthurno1,8,2,2023-11-29 20:23:13,How to use use url-retrieve with oauth?,False,Question
zamansky,9,0,2023-11-29 17:38:00,Learning Elisp 15 - finishing up our emoji mode,False,
ghiste,2,4,2023-11-29 16:35:01,multi-system init-file,False,
liesdestroyer,0,7,2023-11-29 13:29:24,Problems with elpaca,False,
ghiste,0,22,2023-11-29 12:14:59,"""Loading a theme can run Lisp code"" - wtf",False,
thephatmaster,27,14,2023-11-29 10:52:28,Need help with fun stuff (zone-matrix) on DooM,False,Question
AutoModerator,6,12,2023-11-29 08:15:08,"Weekly Tips, Tricks, &c. Thread",False,
Speedracer69696969,3,6,2023-11-29 07:37:42,Replacing hyperlinks with shorthand phrase,False,
sebhoagie,23,1,2023-11-29 03:27:17,Read Confluence from Emacs! And JIRA tickets. With caveats.,False,
kalosdaemon,19,0,2023-11-29 03:08:02,Installing and setting up Emacs on NixOS,False,
whudwl,12,0,2023-11-29 01:55:03,TIL: a maildir file is the same as a .eml file,False,Solved
Kronkelman,4,1,2023-11-28 22:47:21,How does Doom/Emacs decide which colour depth to use?,False,Question
dwrz,11,13,2023-11-28 20:26:40,Recommended setup for React development,False,
darkawower,3,66,2023-11-28 18:49:39,Does eglot support autocomplete candidates with the same name?,False,Question
kalosdaemon,6,2,2023-11-28 17:11:44,Maximizing Screen Space with GNU Unifont in Emacs,False,emacs-fu
tarsius_,107,39,2023-11-28 15:45:41,Transient v0.5.0 released,False,Announcement
graduale,1,14,2023-11-28 15:24:44,Smaller size in mu4e headers view,False,Question
eis3nheim,2,2,2023-11-28 15:08:31,"Org roam error, ""Error running timer""",False,Solved
ragnese,12,25,2023-11-28 14:32:14,It is recommended to not use lambdas in (add-hook) expressions. Is there a better way to do (setq)s for major modes without (add-hook) at all?,False,
domsch1988,10,14,2023-11-28 14:15:16,Advent of Code in Emacs Lisp?,False,Question
gopar,1,0,2023-11-28 13:20:20,"Web template jump to definition function (Django, Jinja2)",False,
totemus_prime,17,29,2023-11-28 04:04:50,Emacs Meets ChatGPT for Flawless* Grammar and Spelling,False,
MitchellMarquez42,6,3,2023-11-27 23:12:58,standalone Ex implementation?,False,Solved
avrumle,6,11,2023-11-27 22:19:26,Emacs lagging - help me understand this profiler report?,False,
Nicolas-Rougier,12,6,2023-11-27 21:22:56,Org-mode tag right alignment,False,
akuszyk,21,7,2023-11-27 19:50:01,Thank you to the author of the terraform-doc package!,False,
tonyaldon,39,21,2023-11-27 17:19:36,[NEW] one.el - Static Site Generator for Emacs Lisp programmers,False,
refidy,3,2,2023-11-27 16:13:56,How can I remove repetition in python REPL?,False,
Big-Bluejay7122,7,2,2023-11-27 16:02:39,emacs lsp-mode with MPLAB X project,False,
DeinOnkelFred,2,2,2023-11-27 10:38:25,`S-c` mysteriously interpreted as `C-`,False,Question
lovegirin,6,14,2023-11-27 10:30:45,Best way to search org-mode files?,False,
chewxy,18,14,2023-11-27 09:21:55,Has anyone reverse engineered the VSCode Live Sharing protocol for emacs yet?,False,Question
johlae,5,8,2023-11-27 08:04:54,A weird problem with elpa.gnu.org and mastodon.el,False,
anton-rs,1,1,2023-11-27 07:50:47,how do I remove empty agenda or custom it?,False,
DocInLA,1,12,2023-11-27 01:11:08,How do I Install Emacs to the Host that I Built in a Virtual Machine?,False,
ndrwnaguib,17,4,2023-11-27 00:23:47,Elfeed-ArXiv integration,False,
ReneFroger,32,4,2023-11-26 16:39:03,[Package of the day] Dirvish: a combination of Dired and Ranger,False,
No-Belt-2789,1,0,2023-11-26 16:04:36,Config mu4e to use gpg subkey for signing,False,
Evil_Malloc,6,14,2023-11-26 11:50:26,Moving to Emacs - getting issues out of the box,False,
copingbear,3,5,2023-11-26 11:09:56,Enabling python-ts modę causes my Emacs memory usage to blow up,False,
paarulakan,1,6,2023-11-26 10:51:07,issue when running with ob-async,False,
igoryon,3,1,2023-11-26 07:09:27,configure line commenting,False,
Both_Confidence_4147,2,29,2023-11-26 06:57:53,What is the point of using Vterm or Eat?,False,
SlowValue,5,2,2023-11-26 00:29:29,calc's elisp function documentation.,False,Question
Fluffy_Professor_639,7,3,2023-11-25 23:05:37,Is the async functionality already merged?,False,
Unknown,1,3,2023-11-25 21:36:21,Sending notification from Android Emacs,False,Question
Both_Confidence_4147,18,47,2023-11-25 11:31:23,How to show what separates emacs from other IDEs,False,
SaraBiYo,43,16,2023-11-25 10:33:26,Karthinks - Different strokes for different folks,False,
vfclists,4,3,2023-11-24 22:22:30,Does org have a command to hide all the drawers and just show the headline and the text below the properties drawers?,False,
maufdez,5,2,2023-11-24 20:20:23,Diary Appt Alert Behavior,False,
bbroy4u,21,16,2023-11-24 18:45:49,Emacs alternative for window animations like these?,False,
xenodium,104,12,2023-11-24 15:29:06,Emacs Swift module is wonderful for macOS native UX integrations,False,
Winter_Fall8260,8,9,2023-11-24 14:24:00,Using local language server for remote files,False,
p-orbitals,6,2,2023-11-24 13:50:48,EmacsWiki: Moving The Ctrl Key,False,
emacspls,16,18,2023-11-24 07:27:13,"Hello lag, my old friend",False,
paarulakan,7,5,2023-11-24 04:34:53,elpaca fails to access the repos.,False,
Fluffy_Professor_639,6,7,2023-11-24 02:45:42,Can i run emacs gui on a quest 3?,False,
blue_turnip5,2,7,2023-11-24 02:06:01,"emacs not responding to keystrokes, only showing in terminal mac",False,
stevemolitor,10,6,2023-11-23 23:32:42,"Turning on font ""smart kerning"" or ""texture healing"" in Emacs",False,
jamescherti,6,1,2023-11-23 22:54:43,Open a Vertico/Consult or Ivy/Counsel candidate in a new tab,False,
BlurbKey5b2e10fa,3,4,2023-11-23 22:42:15,Coding system warning prompt when saving GPG file,False,Question
moseswithhisbooks,3,7,2023-11-23 22:09:48,“C-x C-e for Java”: Inline eval of Java exprs to produce a gallery app,False,
Kinetic-Turtle,5,11,2023-11-23 19:07:32,"I want to journaling, but I need a few specific things. Can you tell me if Emacs can do them, before start learning it?",False,
